The paper proposes a method to model a latent variable that encodes the time-varying aspect of the dynamics of a robot. The proposed work provides a wrapper around the Kalman filter. The key idea of the proposed work is to provide a wrapper around the Kalman filter. The paper misses out on recent works by Xie et al. (2020) that build upon the work by Nagabandi et al. (2018a;b) and Finn et al. (2020). They look at a very similar HiP-MDP setup (and also goes beyond just modeling the time-varying dynamics). The model assumes that,"The paper addresses a few very important points on sequential latent-variable models, and introduce a different view on meta-RL. Even though the methods that this paper poses are incremental, it is such a hot-debated topic that I would prefer to see this published now.",0.8365846276283264
"The paper presents an interesting approach to solving TSP that can outperform some other existing approaches. The proposed method is novel, might be significant, and the quality of this paper seems to be on-par with other papers applying ML techniques to solve TSP published at top-tier conferences (which are also cited in this paper). All the percentages of optimally solved problems are relatively low, so the plots for some algorithms are not clearly visible (however, it is clear that the introduced algorithm outperforms other approaches). I recommend acceptance of this paper.","In this paper, a novel machine learning-based method for solving TSP is presented; this method uses guided local search in conjunction with a graph neural network, which is trained to predict regret. Reviewers disagree rather sharply on the merits of the paper. Three reviewers think that the paper is novel, interesting, and has good empirical results. Two reviewers think that the fact the results are not competitive with the best non-learning-based (""classic"") solvers mean that the paper should be rejected. This area chair believes that research is fundamentally not about beating benchmarks, but about new, interesting, and sound ideas. The conceptual novelty of this method, together with the good results compared with other learning-based methods",0.8592230677604675
"The discussion of the optimization issue caused by the NLL is very clear with nice synthetic examples. The paper is well written and mostly easy to follow. It seems like thereâ€™s significant overlap between the performance of the different methods. The notation in Equation (9) is confusing. There is a long line of work about ""critically"" initializing neural networks so that their curvature grows exponentially with depth. The authors might consider looking at Poole et al., ""Exponential expressivity in deep neural networks through transient chaos"" and Raghu et al., ""On the expressive power of deep neural networks""","The paper examines the approach of modeling aleatoric uncertainty by fitting a neural network, that estimates mean and variances of a heteorscedasitic Gaussian distribution, based on log likelihood maximization. The authors identify the problem that gradient based training on the netgative log likelihood (NLL) may result in suboptimal solutions where a high predicted variance compensates for the predicted mean being far from the true mean. To solve this problem, the authors suggest to adjust the log likelihood objective by weighting the log likelihood of each single data point by the corresponding beta-exponentiated variance estimate. This adjusted objective is referred to as beta-NLL. All reviewers agreed that the identified problem and",0.8238109350204468
"This paper shows that DDPMs are good representation learners. The paper is well written. The experiments and baselines are well-motivated. Most importantly, this can lead to further research on DDPMs as feature extractions. Most importantly, this can lead to further research on DDPMs as feature extractions.","The paper proposes using the intermediate representation learned in a denoising diffusion model for the label-efficient semantic segmentation task. The reviewers are generally positive with the submission. They like the simplicity of the proposed algorithm. They also like the effort of the paper in verifying the intermediate representation learned by a diffusion model is semantically meaningful and can be used for segmentation. Initially, there was some concern about the size of the validation set, which is addressed by the rebuttal. Consolidating the reviews and rebuttals, the meta-reviewer agrees with the assessment of the reviewers and would like to recommend acceptance of the paper.",0.8416284918785095
The approach does not require re-training (doing pre-training again) experimental results on several tasks show only a small drop in model quality. The reduction in the number of parameters is modest compared to methods that re-train the network in a compact representation.,"The paper studies the problem of task-specific model compression obtained from fine-tuning large pre-trained language models. The work follows the line of research in which model size is reduced by decomposing the matrices in the model into smaller factors. Two-step approaches apply SVD and then fine-tuned the model on task specific data. The present work makes the observation that after the first step (the SVD compression) the model can dramatically lose its performance, due to the mismatched optimization objectives between the low-rank approximation and the target task. The work provides evidence backing this claim. The paper proposes to address this problem by weighting the importance of parameters for the factorization according to the Fisher information.",0.8501104712486267
"The proposed approach is technically sound and exhibits very competitive performance. The empirical evaluation is thorough as it considers multiple test problems and a broad range of benchmark methods. In particular, I am having a hard time understanding how the decoder is defined when the problem instance is not a graph. The use of the term ""preference"" is confusing. The paper is well-written and presents an interesting approach to solving MOCO problems. The paper is well-written and presents an interesting approach to solving MOCO problems. The proposed method is novel, might be significant, and the quality of this paper seems to be on-par with other papers",This paper develops a preference-conditionedâ€ approach to approximate the Pareto frontier for Multi-Objective Combinatorial Optimization (MOCO) problems with a single model (thus dealing with the thorny problem that there can be exponentially-many Pareto-optimal solutions). It appears to provide flexibility for users to obtain various preferred tradeoffs between the objectives without extra search. The basic idea is to use end-to-end RL to train the single model for all different preferences simultaneously. The technical soundness and practical performance are strong. This work's approximation guarantee depends on the ability to approximately solve several (weighted) single-objective problems. This may be challenging due to the NP-hardness of,0.8340883851051331
"This paper proposes a new method for contrastive learning, called Proto CPC. The proposed method is well described and seems to work as shown by sufficient experiments in various distillation settings. The main concern is the novelty of this method. It combines the method and contrastive learning while these two techniques are well researched in the literature. Also, compared with CRD+KD the improvement is marginal in the knowledge distillation task. After rebuttal: I keep my original rate. I think this paper is well presented with decent results. I think this paper is well presented with decent results. I think this paper is well presented with decent results. I think this","This paper proposes a prototypical contrastive predictive coding by combining the prototypical method and contrastive learning, and presents its efficient implementation for three distillation tasks: supervised model compression, self-supervised model compression, and self-supervised learning via self-distillation. The paper is well-written, and the effectiveness of the proposed method is validated through extensive experiments. Reviewers generally agree the paper has clear merits despite some weaknesses for improvement. Overall, I would like to recommend it for acceptance and encourage authors to incorporate all the review comments and suggestions in the final version.",0.8572850823402405
"The paper provides a plausible causal representation of the adversarial attack process and derives a useful explanation for vulnerability. The robustness approach derived from their explanation is quite reasonable and is novel to my knowledge. I am not sure about all the assumptions used here (e. g., independent gaussians), but at least on the benchmarks reported, the method performs well. I am not sure about all the assumptions used here (e. g., independent gaussians), but at least on the benchmarks reported, the method performs well. The authors provide an interpretation of past methods within their framework, which I thought was a nice insight","The paper shows a causal perspective to the adversarial robustness problem. Based on a causal graph of the adversarial data creation process, which describes the perceived data as a function of content and style variables, the authors identified that the spurious correlation between style and label is the main reason for adversarial examples. Based on this observation, they propose a method to learn models for which the conditional distribution of label given style and image does not vary much when attacked. Experiments on MNIST, CIFAR-10, and CIFAR-100 datasets show that the proposed method is better than two baselines, Madry and TRADES. Overall, the paper contains interesting ideas and tackles an important problem. Due to some concerns regarding the clarity",0.8381575345993042
This paper proposes a single optimization problem for linear transformation of fairness. The robustness criterion can be formulated as a single optimization problem as long as the ambiguity set is defined using a single normal distribution. A smooth reformulation is presented which can be solved using standard riemannian gradient descent algorithm. The theoretical results are relatively easy to derive based on existing results on distributionally robust optimization and riemannian optimization.,"This paper considers the problem of distributionally robust fair PCA for binary sensitive variables. The main modeling contribution of the paper is the consideration of fairness and robustness of the PCA simultaneously, and the main technical contribution of the paper is the provision of a Riemannian subgradient descent algorithm for this problem and proof that it reaches local optima of this non-convex optimization problem. The results will be of interest to those working at the intersection of fair and robust learning.",0.870957612991333
The proposed attack is straightforward and empirically effective against different defense strategies. The performance proposed method is also impressive under the combination of different defense methods. The main contribution of this paper is from the empirical side. The problem addressed is very interesting in terms of pointing out a major deficiency in neural graph embedding models against GIA attacks. I believe the contribution of this work is significant in that further work can be built on their results to address vulnerability in deep graph models.,"The reviewers agree that this paper studies an important problem, provides theoretically analysis to understand graph injection attack. The authors propose a new regularizer to improve the attack success. Extensive experimental results also show the effectiveness of the proposed method.",0.8691888451576233
"This paper presents an approach for learning the architect of a new communication channel. The goal of the paper is relevant for the conference, as a communication channel is directly learned and the framework somewhat works towards the bigger goal of AGI. However, it would be useful to add more real world applications of the approach. The empirical evaluation is informative, although the random building agent does not give too much additional insight. It would be good to show relevant ablations in the main part of the paper. There are differences between the frameworks and [1] might work towards HRI (as also mentioned in the paper), but the direction seems quite related","This paper proposes a cognitive science-inspired interaction setting between two agents, an ""architect"" and ""builder"", in which the architect must produce messages to guide the builder to achieve a task. Unlike other related settings (such as typical approaches in MARL, HRL, or HRI), the builder does not have access to the architect's reward function, and must learn to interpret the architect's messages by assuming the architect is telling it to do something sensible. At the same time, the architect determines what is ""sensible"" by building a model of the builder's behavior and planning over it. This setting is common particularly in human-agent interactions, where humans may not",0.8266703486442566
"The main contribution is that they propose that classification performance mostly results from iterated phase collapses. The theoretical analysis is nice, and not to hard to follow, once one commits. In particular, I find the results in Table 2 very convincing. The theoretical analysis is nice, and not to hard to follow, once one commits. It would be interesting to make more explicit the analysis for different types of nonlinearities.","This paper proposes that the superior performance of modern convolutional networks is partly due to a phase collapse mechanism that eliminates spatial variability while ensuring linear class separation. To support their hypothesis, authors introduce a complex-valued convolutional network (called Learned Scattering network) which includes a phase collapse on the output of its wavelet filters and show that such network has comparable performance to ResNets but its performance degrades if the phase collapse is replaced by a threshold operator. Reviewers are all in agreement about the novelty and significance of the work. They also find the empirical results compelling. The main weakness of this work which was highlighted by all reviewers is clarity. The paper can be significantly improved in terms of the",0.8463980555534363
"The goal of augmentation invariance is well motivated in speech recognition, and ML/ representation learning. The paper is well written with the following strengths. The proposed method is self-supervised learning with the teacher-student framework that is an extension to Mean Teacher (MT) and Boost Your Own Latent (BYOL). The proposed method is a novel one that aims to learn the representation denoising of perturbation data with the teacher-student framework. In addition, the proposed method can also be combined with multi-condition training to improve the noise-robustness.","This paper proposed a self-supervised speech pre-training approach, by the name of SPIRAL, to learning perturbation-invariant representations in a teacher-student setting. The authors introduced a variety of techniques to improve the performance and stabilize the training. Compared to the popular unsupervised learning model wav2vec 2.0, better WERs were reported using SPIRAL with a reduced training cost. All reviewers considered the work solid with sufficient novelty but also raised concerns regarding the generalization under unseen real-world noisy conditions and missing decoding details. The authors responded with new Chime-3 results and updated LM decoding results. The new results show that, after a bug fix, SPIRAL can outperform wav2",0.8472395539283752
"The proposed method provides some useful results, but there are some questions needed to be answered. This is not comprehensive to show the advantages of the proposed method in the imbalanced classification. The problem is very important. The solution is novel from theoretical perspective, and it is evident in the experiments as well. The competing methods does not only contain previous published work but also include its variants to improve the performance, which make the proposed method further attractive.","To solve imbalance classification problem, this paper proposes a method to learn example weights together with the parameters of a neural network. The authors proposed a novel mechanism of learning with a constraint, which allows accurate training of the weights and model at the same time. Then they combined this new learning mechanism and the method by Hu et al. (2019), and demonstrated its usefulness in extensive experiments. I would like to thank the authors for their detailed feedback to the initial reviews, which clarified most of the unclear points in the manuscript. Overall the paper is well written and the effectiveness was demonstrated in experiments. Since the contribution is valuable to ICLR2022, I suggest its acceptance.",0.8509044051170349
"The paper provides a comparison to recent methods on IS, FVD, and KVD evaluation metrics. This helps to understand better the performance of the introduced model on video generation.","This work tackles video generation using implicit representations, and demonstrates that using these representations enables improvements to long-term coherence of the generated videos. Reviewers praised the writing, the thorough experimental evaluation, and the strong quantitative results. Some concerns were raised about a lack of discussion of relevant related work, novelty/significance, model architecture, and a lack of qualitative examples, many of which the authors have tried to address during the discussion phase. Several reviewers raised their ratings as a result. Personally I certainly believe that exploring implicit representations for video is important, and I know of no published prior work in this direction, which amplifies the potential significance of this work. Even if results are qualitatively worse than previous work",0.8522640466690063
"The method seems relatively well motivated, and the experiments seem well executed. The paper could use more editing. There are various typos (some below) and many phrasings that could be improved. The lack of human-in-the-loop baselines seems potentially problematic. The same could be said about the environment â€“ given how promising this method seems to be in that context. However, there is one missing experimental comparison that I would like to see before I can recommend an accept.","The paper presents a new algorithm for augmenting RL training with human examples, and this is applied to learning safe driving policies. This algorithm is properly tested and compared to other relevant algorithms with favorable results. Reviewers agree that this is good work and that it should be published. Reviewers had multiple questions, which were in my opinion answered satisfactorily by the authors. Notably, the authors ran additional tests against other human-in-the-loop RL algorithms with good results. In sum, this seems to be a solid paper, worth accepting.",0.856212854385376
"This paper proposes a technique called cross-lingual manifold mixup or X-mixup, which has been inspired by mixup (Zhang et al.,Footnote and Filter (Fang et al., 2020)). The general idea is to combine the hidden representations corresponding to the source-language input with the hidden representations corresponding to the target-language input (in a smarter way than concatenating them). The authors combine this with a specific mixup ratio based on translation quality and 2) scheduled sampling. They perform multiple experiments using two pretrained models (mBERT and XLM-R) and show that their proposed approach","This paper proposes X-Mixup, a model that considers the source languages and target languages together for cross-lingual transfer. The designed model takes a pair of sentences (or the translated sentences) in a source language and a target language as the input and computes the cross-attention between them. The empirical results are convincing. Reviewers think this paper is well-written and the idea is interesting.",0.8589601516723633
"This paper investigates the applicability to clustering methods for selection of policies in evolutionary strategies. The authors present a convincing method that performs well on several toy problems. This is an interesting area of study and the authors present a convincing method that performs well on several toy problems. I would be interested to see how well the clustering algorithm performs at identifying behaviours â€“ for example, a demonstration that policies sampled from the clusters do indeed lead to diverse behaviours when examining those policies that were ranked highly but distinct. The paper is well-written with a clear goal developing a method that optimises for diversity in addition to fitness. The main contributions include sampling policies and","This paper introduces a novel quality-diversity algorithm, ""Evolutionary Diversity Optimization with Clustering-based Selection (EDO-CS)"", and applies it to reinforcement learning. A bandit approach (UCB) is used to select which cluster to sample parents from. The QD algorithm can be evaluated on its own, outside of the RL context, and if so it should be compared to the several approaches to niching and other standard diversity preservation approaches in evolutionary computation that rely on clustering. (And the authors should make an effort to connect to the niching literature in particular.) However, the use of the algorithm for RL makes it possible to use behavioral features as the space in which to",0.8365107774734497
"This paper proposes a dynamic scale convolution for learning-based multi-view stereo. The proposed method uses curvature information to select the patch scale. Although the method does not use deep learning, it limits the technical contribution of this paper. In the related work section, this paper claims that the proposed method should have an advantage of performance compared with Xu et al. (2020) because they do not rely on the handcrafting features. However, the claim was not confirmed through the experiments. The authors added a comparison of the proposed method with Xu et al. (2020). Overall, the paper is relatively well structured, each section is of",All reviewers recommended accept after discussion. I am happy to accept this paper.,0.8319023847579956
"This paper proposes a variance aware approach for offline RL, which leads to the pessimistic value estimation. The paper exploits the reweighted Bellman update, which leads to the improved bounds.","In this paper, the authors motivate the paper well by the gap between the upper bound of the popular offline RL algorithm and the lower bound of the offline RL. By exploiting the special linear structure, the authors designed a variance-aware pessimistic value iteration, in which the variance estimation is used for reweighting the Bellman loss. Finally, the upper bound of the proposed algorithm in terms of the algorithm quantity is proposed, which is more refined to reflexing the problem-dependency. These results are interesting to the offline RL theoretical community. As the reviewers suggested, several improvements can be made to further refinement, e. g., - The intuition about the self-normalization in the algorithm exploited",0.8786583542823792
"This paper introduces several decomposition methods and makes a comprehensive comparison among them from the perspective of compressing Transformer layers. The motivation is clear and the methods are technically sound. The experimental results demonstrate the effectiveness of the method. The authors do not include embedding layer and prediction layer size in experiments, while only report the Transformer encoder size.",This paper reviews a number of parameter decomposition methods for BERT style contextual embedding models. The authors argue for the application of Tucker decomposition to the attention and feedforward layers of such models. Evaluation is performed for a range of models on the GLUE benchmark. Further ablation studies indicate that the distillation procedure employed is crucial for obtaining competitive results and the raw decomposition approaches are ineffective at directly approximating the original pre-trained model. Strengths: The reviewers generally agree that the methods explored and results presented in this paper are interesting and could be of use to those deploying large embedding models. The authors review a range of possible decomposition methods and use this to motivate their approach. The resulting levels compression are high,0.8609800338745117
