"This paper proposes a simple method to fine-tune existing code translation models without the need to manually curate parallel data. The method does not require any changes to the training procedure of the model, and can be independently applied in the fine-tuning stage. The authors propose to utilize an automated test generation suite to build this parallel data from the model itself. It requires an automated unit test generation tool to be available for at least one of the languages. I have 2 concerns with this proposal: It requires an automated unit test generation tool to be available for at least one of the languages. The proposed method therefore, in my opinion, is","This paper is about unsupervised translation between programming languages. The main positive is that it introduces the idea of using a form of unit test generation and execution behavior within a programming language back-translation setup, and it puts together together a number of pieces in an interesting way: text-to-text transformers, unit test generation, execution and code coverage. Results show a substantial improvement. The main weaknesses are that there are some caveats that need to be made, such as the (heuristic, not learned) way that test cases are translated across languages is not fully general, and that limits the applicability. There are also some cases where I find that the authors are stretching claims a bit beyond what experiments",0.8444051146507263
The rejection-sampling-based method is definitely the main focus of the paper. The paper makes substantial progress in scaling up NDPPs and opens up new avenues for applying NDPPs to various real-world scenarios.,"This is an exciting paper that provide the efficient algorithms for exact sampling from NDPPs along with theoretical results that are very pertinent in and out themselves. The AC agree with the reviewers that the authors satisfactorily addressed the concerns raised in the reviews, and is convinced that the revised version will be greatly appreciated by the community. We very much encourage the authors to pursue this line of work and in particular to overcome the practical restriction to the ONDPP subclass.",0.8625884652137756
"This work is an extension of the work by Bradshaw, Gottipatti and Horwood, which addresses some of the limitations of these models. The paper should be clearly presented as an investigation and extension of the work by the authors. There is no mention of the RetroDog model by Bradshaw. This would not detract from its quality or value, which in my opinion is considerable.","After much back and forth about prior work, 3 reviewers score this paper as an 8 and one scores it as a 3. Other reviewers have written to the 3 and told them they believe that their review is now too harsh, in light of clarifications w. r. t. related work. I tend to agree, though I must admit that I am not an expert on this topic. Given that there is almost unanimous support for accepting and it's possible that the one hold-out has not seen some of the extra information, I recommend acceptance. Given the praise from the other three reviewers, I moreover recommend a spotlight.",0.8348283171653748
"This paper studies the problem of computationally designing antibody CDRs. The generation method is flexible and the authors adapt it for conditional generation. The paper is well-written and easy to follow. The proposed refinement method has high novelty and outperform state-of-the-art baseline methods. The experimental evaluation may be problematic, it is not convincing to use machine learning methods to predict the neutralization ability based on CDR H3.","This paper proposes use of a novel generative modelling approach, over both sequences and structure of proteins, to co-design the CDR region of antibodies so achieve good binding/neutralization. The reviewers are in agreement that the problem is one of importance, and that the technical and empirical contributions are strong. There are concerns over the relevance of evaluating the method by using a predictive model as ground truth. Still, the overall contributions remain.",0.8747814297676086
"This paper presents a new method to predict the future churn of a model. The authors provide theoretical guarantees to justify the use of their algorithm. The authors provide empirical justifications of the proposed algorithm using many datasets and baselines. There is some citation on these in the related work, however the problem introduction needs some justification e. g. literature on churn being hurtful in production settings etc. The paper can be improved by addressing a few points as below: The authors presented the claim that their process corresponds to a value of  that constrains the churn in the primal setup. While possibly trivial, the methods to use this distillation process","The paper introduces a procedure to control the churn (i. e. differences in the predictive model due o retraining) using distillation. This is a strong paper, with novel technique which is clearly presented, and is backed by sound theory. The experimental results were also deemed extremely convincing by reviewers TJ4g and pZBb. Reviewer nqfu raised a question about the similarities between churn reduction and domain adaptation. The authors have addressed this by pointing out similarities to their work but also noting that, in the settings mentioned by the reviewer, alternative approaches such as completely retraining the model might be more appropriate. This part of the rebuttal is convincing. Reviewer TJ4g has pointed out several",0.8474727869033813
"The paper presents a method that is novel in terms of the motivation, theory and experiments, in order to learn the structural function. The authors present error analyses for the density ratio and the causal function, as well as experiment results comparing their work to recent algorithms in the field. In particular, as a minor point, I think the abstract is a bit too vague and would benefit from a more precise description of what the paper is about. I appreciate the honest assessment of the relevance of the chosen settings for the proposed method. The experiments are well described and motivated. I appreciate the honest assessment of the relevance of the chosen settings for the","This paper proposes a method that uses conditional moment restriction methods to estimate causal parameters in non-parametric instrumental variable settings. This is done by converting to an unconditional moment restriction setting common in the econometrics causal inference literature. The paper was reviewed quite favorably by reviewers, and the authors updated the manuscript to address specific issues raised by reviewers.",0.8493472933769226
"This paper proposes a new algorithm to improve the performance of generative models. The paper proposes a new algorithm to improve the performance of generative models. The authors provide a number of clarifications and illustration figures. The writing is overall clear. There are abundant experiments, with many comparisons among different methods and ablation studies of the proposed method. There are some vague parts in the current version. I would raise my score if the authors could properly address the questions.","The paper provides a method for with tuning continuous hyperparameters (HPs). It is closely related to a previous work (Lorraine, 2019) that was limited to certain HPs, and in particular could not be applied to HPs controlling the learning such as learning rate, momentum, and are known to be influential to the convergence and overall performance (for non-convex objectives). The reviews indicate a uniform opinion that the paper tackles an important problem, that its methods provide a non-trivial improvement over previous techniques and in particular those of (Lorrain, 2019), and that the provided experiments are extensive and convincing. The initial reviews had several concerns about technical details in the paper such as",0.8437319397926331
"This paper proposes a new method for down-weighting by variance and using probabilistic ensembles to improve the performance of Reinforcement Learning. The reviewers found the paper to be very well written and the approach very well embedded in the current literature. There were some concerns about the lack of clear math and pseudocode applying the method to the RL setting, and the analysis of the sources of uncertainty (sec 3.1.2) is perhaps novel. Despite the lack of novelty, if the theoretical or empirical results were strong, then acceptance could be justified. The proposed IV-RL method seems to be an improvement without drawbacks (except for additional hyper-",The reviewers unanimously appreciated the clarity of the work as well as the framing of the proposed method. Congratulations.,0.8533623814582825
This work fails to discuss a whole body of relevant literature that also aims to train neural networks. As a result the chosen baselines for the experiments section fail to show how effective this method actually is.,"This work considers one-shot pruning in deep neural networks. The main departure from previous work is to consider stochastic Frank-Wolfe. The reported results are convincing although a number of baselines were missing from the initial submission. The authors provide a balanced account of the strengths and weaknesses of the proposed approach. The authors adequately addressed the concerns of the reviewers. For instance they ran additional experiments to compare to missing pruning baselines. I would encourage the authors to revise the manuscript by including the missing related work, the additional clarification discussions (e. g., motivation for K-sparse constraints, follow-up analysis, and cost per iteration) and to include the additional experiments that were conducted (",0.8518803715705872
"This paper presents a novel approach to the problem of skill discovery for RL and continuous control. The proposed model integrates both discrete and continuous latent variables into a policy. The proposed architecture seems to work, and I was particularly interested in the comparison with a hierarchical behaviour cloning model. Results show the proposed architecture seems to work, and I was particularly interested in the comparison with a hierarchical behaviour cloning model. This area is of particular interest as we move beyond ""look we discovered some skills and re-used them"" to more realistic online learning settings. The paper is in some need of smoothing, and I found this a difficult read, despite being","This work propose to learn hierarchical skill representations that, as opposed to prior work, consist of both discrete and continuous latent variables. Specifically, this work proposes to learn 3 level hierarchy via a hierarchical mixture latent variable model from offline data. For test time usage and adaptation on down-stream tasks, the manuscript proposes two ways of utilizing the learned hierarchy in RL settings. **Strengths** A novel method to learn hierarchical representations with mixed (discrete/continuous) latent variables is proposed Detailed experimental evaluation, and baseline comparisons, show promising results **Weaknesses** There were various clarity issues as pointed out by the reviewers (fixed in rebuttal phase) The related work was missing relevant work, and the",0.8481714129447937
"This paper is well written and organized. Overall, this paper is well written and organized. However, there are no comparisons made to those presented in Yuan et al., 2020, which introduced the AUCM loss. However, there are no comparisons made to those presented in this paper. The paper is well written and organized. Overall, this paper is well written and organized.",I recommend this paper to be accepted. All reviewers are in agreement that this paper is above the bar.,0.859978199005127
"The proposed method- using Bivariate Shapley values to study feature interactions- is novel and reasonable. Considering data in DAG format is reasonable and their connections are represented as edges. The paper provides extensive empirical results, which indicate that the approach is a good explanation for measuring the influence of features on each other. The authors provide both theoretical justification as well as good illustrative examples. The proposed method performed better in both types of tasks. One important aspect is that there is quite some noise in the graph edge from Shapley estimation. The authors claim that their method can be extended into high-order scenarios, and provide a method to calculate","In this paper, the authors generalize the univariate Shapley method to bivariate Shapley method. The authors first build a directly graph based on the asymmetric bivariate Shapley value (adding feature j to all sets contained feature i). Then several graph algorithms are applied to analyze the directly graph to derive (1) univariate feature importance available in univariate approach and (2) relations like mutually redundancy only available in bivariate approaches. Experiments on several datasets with comparison to existing methods demonstrated the superiority of the proposed method. All reviews are positive.",0.8502970933914185
"The paper is an impressive empirical study covering a vast range of variations, baselines and ablations. All experiments are repeated multiple times and the paper is well summarized. The necessary background and related work is briefly, but well summarized. Experiments are and findings are well presented - though given the sheer number of experiments and results some parts of the paper appear a bit crammed (but there is no easy solution to this given the limitations of a conference-format paper). The paper lays the groundwork for now digging deeper into some of the findings. I have some small suggestions for improvements, but am currently in favor of accepting the paper.","This paper studies the Lottery Ticket hypothesis in reinforcement learning for identifying good sparse representations for low-dimensional tasks. The paper received initial reviews tended towards acceptance. However, the reviewers had some clarification questions and concerns. The authors provided a thoughtful rebuttal. The paper was discussed and most reviewers updated their reviews in the post-rebuttal phase. Reviewers generally agree that the paper should be accepted but still have good feedback. AC agrees with the reviewers and suggests acceptance. However, the authors are urged to look at reviewers' feedback and incorporate their comments in the camera-ready.",0.8374848365783691
This paper focuses on class-imbalanced learning and shows that self-supervised training yields that are more robust to imbalance datasets. The paper is well written in general and its motivation is clear. The only task considered in the paper is image classification using the standard accuracy as the evaluation metric. Is the observed robustness also valid for other tasks?,"This paper is proposed to investigate the robustness of self-supervised learning (SSL) and supervised learning (SL) in both balanced (in domain) and imbalanced (out of domain) settings. It can be concluded that SL can regularly learn better representations than SSL, and representations are better from balanced than from imbalanced datasets. The SSL is more robust than SL in the imbalanced settings, which is the crucial of this paper. Expect the experimental results, the authors also provided theoretical analysis to support their claims. The authors also extend a well-established method SAM into the Reweighted SAM as the technical contribution to better address the imbalanced setting. The paper is well written with clear logic to follow",0.8599340915679932
"This paper presents an ab initio method that does not require a training dataset. It is unclear how the PESNet compares to the the trained methods when they are trained on very large and diverse datasets like OC20. The paper uses a lot of terminology that is difficult to follow for somebody without a background in chemistry. I would urge the authors to change the text to make it easier to follow. The manuscript is well written and theory and experiments are presented in a concise fashion. The idea of coupling neural wavefunctions for different nuclear configurations with a meta-GNN is promising, since this allows for simultaneous solution with VMC","This paper builds on the success of the FermiNet neural wave function framework by pairing it with a graph neural network which predicts the parameters of neural wave function from the geometry. The resulting PESNet trains significantly faster, with no loss of accuracy. This method constitutes an important advance in ML-powered quantum mechanical calculations. The reviewers unanimously recommend acceptance.",0.857977032661438
"The proposed solution to the technical challenge of the Bernstein-type analysis under this scenario is novel. Moreover, the paper is well organized. However, several issues/limitations preclude me from fully accepting this paper.","This paper addresses the reward-free exploration problem with function approximation under linear mixture MDP assumption. The analysis shows that the proposed algorithm is (nearly) minimax optimal. The proposed approach can work with any planning solver to provide an ( +opt )-optimal policy for any reward function. After reading the authors' feedback and discussing their concerns, the reviewers agree that the contributions in this paper are valuable and that this paper deserves publication. I encourage the authors to follow the reviewers' suggestions as they will prepare the camera-ready version.",0.859584391117096
"This paper considers the problem of NCD in a new perspective and rigorously formulates the NCD setting. A theoretical analysis is provided to demonstrate when the NCD setting can be solved. In addition, they reveal that NCD can be solved if known and novel classes are related. The authors give detailed algorithms and the source code, which can help readers better understand and reproduce the proposed method. All the results include the standard deviation, which is important for reflecting the real improvements on the CIFAR and SVHN. The work contributes to some intuitive notions of learnability in terms of epsilon-separation and consistent semantic transformation sets.","All reviewers believe that this paper is valuable, and the authors have made a significant, careful contribution. Some suggestions from the area chair: - ""in causality"" is not a standard technical term and also not non-technical idiomatic English, so it should be explained the first time it is used. - The authors should briefly cite and discuss research on so-called positive and unlabeled (PU) learning. This seems like the special case where there is exactly one known class and one novel class. The distinction between sampling in causality and labeling in causality appears in the PU literature, though not under this name. - The authors could also mention the obvious but surprising point that if data are generated by two",0.8305627703666687
"The paper presents an argument that model-based RL should have special value in situations when safety and efficiency is a concern. The paper raises interesting questions, but ultimately cannot compellingly make the case for the proposed approach. The paper does not systematically address where such a model would come from, or how errors in the supplied model might affect performance. This is a critical issue in differentiating between model-free and model-based RL.",The paper describes a new model-based RL technique for constrained MDPs based on Bayesian world models. It improves sample efficiency and safety. The reviewers are unanimous in their recommendation for acceptance. This represents an important advance in RL. Great work!,0.8748064041137695
"This paper observes that when the encoder and decoder belong to the exponential family, only general linear models satisfy â€˜consistencyâ€™ or even approximate consistency. The paper also shows in Corollary 1 that a flexible encoder network cannot make up for the lack of flexibility in encoder distribution.",Wide agreement from the reviewers. Interesting theorems. Empirical work illustrates the theory. Claim and insight: failure of VAEs is caused by the inherent limitations of ELBO learning with inflexible encoder distribution. Good discussion pointed out related work and insights from the experiments.,0.843722939491272
"This paper consolidates a number of existing techniques, including TDMs, Learning from Play, GCSL, and Decision Transformer (DT), into the same umbrella of ""hindsight information matching"" algorithms in the spirit of hindsight relabeling.","The paper describes a framework that unifies several previous lines under hindsight information matching. Within that framework, the paper also describes variants of the decision transformer (DT) called categorical DT and unsupervised DT. The rebuttal was quite effective and the reviewers confirmed that their concerns are addressed. The revised version of the paper is significantly improved and consists of an important contribution that should interested many researchers. Well done!",0.8559441566467285
"The paper builds up a variety of optimization methods, building on a line of work in the LFI literature. This leads to a lot of approaches to compare, and there is no clear indication as to what practitioners should use in practice. The proposed algorithms are all sensible tasks, and the connection between the two fields seems like a fruitful area for further exploration.","The paper investigates various approaches, and a unifying framework, for sequence design. There were a variety of opinions about the paper. It was felt, after discussion, that the paper would benefit from a sharper focus, and somewhat suffers from being overwhelmed by various approaches, lacking a clear narrative. But overall all reviewers had a positive sentiment, and the paper makes a nice contribution to the growing body of work on protein design.",0.8701437711715698
The paper proposes a new decoupled formulation of time series forecasting and formulate the forecasting problem in the modelTS by introducing a prior estimated hidden periodic state and a expansion framework based on residue learning. The proposed model achieves better performances across all datasets compared with state-of-the-art N-BEATS. Especially I find out that DEPTS has a 10% improvement for M4 competition compared with state-of-the-art N-BEATS.,"The paper proposed a novel deep learning model specifically designed for periodic time series forecasting problems. The approach includes lay-by-layer expansion, residual learning, and periodic parametrization. The model outperforms state-of-the-art baselines on several time series forecasting benchmarks. The reviewers appreciate the extensive experimental results, but also suggested improvement on writing and comparison regarding the parameter efficiency of the model.",0.8722603917121887
This paper is generally clear and well written. It could be helpful to add citations in a few places to help the reader who is not already familiar enough with the graph generative models community.,"This paper provides an overview of evaluating graph generative models (GGMs). It systematically evaluates one of the more popular metrics, maximum mean discrepancy (MMD). It highlights some challenges and pitfalls for practitioners and suggests some ways to mitigate them. The reviewers found the paper practically relevant and several reviewers upgraded their scores through the discussion process. The authors acknowledged there are still some remaining issues regarding (i) considering other metrics & descriptor functions; ii) evaluating node/edge attributes and iii) addressing molecule generation. I am satisfied that these areas are beyond the scope of the current work and that the clarification improvements in the paper are adequate. It stands well enough on its own to accept in its present form.",0.8433172106742859
"The paper proposes a novel method for non-classification tasks. The novelty seems solid in terms of novelty, although there might be related work that Iâ€™m not aware of. The overall contribution seems solid in terms of novelty, although there might be related work that Iâ€™m not aware of. The paper is clear regarding the proposed method, although I found it helpful to also read the PostNet paper. However, the dataset is too dense, presumably due to the space constraints. Overall, the experiments convince me of the main goal of the paper, namely that NatPN provides well-calibrated uncertainty estimates for multiple data types.","This paper presents a method for producing higher quality uncertainty estimates by mapping the predictions from an arbitrary (e. g. deep learning) model to an exponential family distribution. This is achieved by using the model to map from the inputs to a low-dimensional latent space and then using a normalizing flow to map to the parameters of the distribution. The authors show empirically that this improves over a variety of baselines on a number of OOD and uncertainty quantification tasks. This paper received 5 reviews who all agreed that the paper should be accepted (6, 6, 8, 8, 8). The reviewers in general found the method novel compared to existing literature, compelling and the results strong. Multiple reviewers asked for experiments with higher dimensional",0.8311043977737427
