"The proposed method of learning hierarchical temporal structures by measuring prior and posterior belief states is new in the area of unsupervised representation learning for video data. The model is compared with VTA only on the Moving Ball dataset, which in my view, is not enough to validate the superiority of the proposed model. The authors may consider to compare with VTA on a more challenging dataset such as Bouncing Balls. I believe this dataset can better support the claim in this paper, because it has more obvious event changes represented by the interactions of multiple balls and is also used in the work of VTA. The model is not compared with any existing approaches","Thanks for your submission to ICLR. This paper considers a variational inference hierarchical model called Variational Predictive Routing. Prior to discussion, several reviewers were on the fence about the paper, most notably having concerns about some of the experimental results as well as various clarity issues throughout the paper. However, the authors did a really nice job addressing many of these concerns. Ultimately, several of the reviewers updated their scores, leading to a clear consensus view that this paper is ready for publication. We really appreciate your effort in providing additional details and results. Please do keep in mind the concerns of the reviewers when preparing a final version of the manuscript.",0.8347018361091614
"This paper proposes a novel method to improve the detection performance on small faces. The proposed methods are effective for detection of objects with wide range of scales. The result on the wider-face dataset is very good, outperforming most of the state-of-the-art approaches. The experiments mainly focus on comparison with some general detectors. There is almost no comparison experiment with some well-known network search methods. The paper is basically a kind of Neural Architecture Search, and would like to see a comparison with at least evolutionary method. The choice of TinaFace as base network is straightforward. However, is it possible that after NAS, a","This paper received 4 quality reviews, with the final rating of 8 by 2 reviewers, and 6 by the other 2 reviewers. All reviews recognize the contributions of this work, especially its superior performance. The AC concurs with these contributions and recommends acceptance.",0.8234718441963196
This work explores more complex environments considering potential attacks from non-target sounds in audio-visual navigation. A joint training paradigm for the agent and the attacker is proposed. Experimental results on Replica and Matterport3D can validate the superiority of the proposed method over recent approaches.,"This paper addresses audio-visual navigation tasks where a reinforcement learning agent perceives visual RGB and binaural audio inputs, rendered in a first-person perspective 3D environment, and is tasked to navigate to the audio source. The authors propose to make the RL navigation policy robust, by training the agent with additional adversarial audio perturbations. These perturbations consist of an adversarial ""ghost"" agent (attacker) that emits noise perturbations volume, position and category determined by policies that are trained to maximise the negative rewards for the navigation agent in zero-sum game. The agent is then evaluated on the simulated Replica and MatterPort3D environments and compared to a few baselines. The authors conduct a large number",0.8613799214363098
"This paper studies a problem of spurious association in fitting a predictive function. The intuition of NuRD is clear. The paper studies a variety of representative data sets. The experimental results show that despite highly different training and test distributions, NuRD is able to greatly reduce the influence of nuisance variables. The proposed method allows to remove many of the strong assumptions that limit the application of competing ones, for example it can be used in high dimensional image classification tasks. The experimental results show that despite highly different training and test distributions, NuRD is able to greatly reduce the influence of nuisance variables. The authors may need to check/explain why Nu","The paper studies how to build predictive models that are robust to nuisance-induced spurious correlations present in the data. It introduces nuisance-randomized distillation (NuRD), constructed by reweighting the observed data, to break the nuisance-label dependence and find the most informative representation to predict the label. Experiments on several datasets show that by using a classifier learned on this representation, NuRD is able to improve the classification performance by limiting the impact of nuisance variables. The main concerns were about the presentation and organization of the paper, which was heavily focused on the theoretical justifications but fell short in explaining the intuitions and implementation details. The revision and rebuttal have addressed some of these concerns and improved the",0.858442485332489
"This paper proposes a new algorithm to detect backdoors in neural networks. The proposed setting and algorithm are novel. In particular, the subtle connection between backdoored networks and sparse adversarial example generation can inspire further research in this direction. The experimental results are comprehensive. Although the experiments do not contain the most recent backdoor detection methods as baselines, this reviewer believes that the current comparison baselines are enough to provide the bigger picture. This is since almost all existing methods are typically designed for the white-box scenario, and as such, they have a huge advantage compared to the current method. The paper is generally well-written, although some","This work proposed to detect backdoor in a black-box manner, where only the model output is accessible. Most reviewers think it is a valuable task, and this work provides a novel perspective of using adversarial perturbation to diagnosis the backdoor. Some theoretical analysis for linear models and kernel models are provided. There is still huge gap to analyze the DNN model. But on the other side, it provides some insight to understand the proposed method and could inspire further studies. Besides, since there have been many advanced backdoor attack methods, and many more are coming out, I am not sure that the proposed detection criteria is well generalizable, considering only some typical attack methods are tested. However, I think the studied problem",0.8633466362953186
"This paper studies the convergence of optimization methods non-iid samples, i. e., divergence of SGD with momentum due to certain resonant gradients in co-variate shift. The reviewers found the paper to be quite well written and exemplary in its scientific format. While the divergence phenomenon is interesting, these two facts make me think that the phenomenon might only occur in very limited settings. While the paper tackles an important question, I think the paper's technical contribution looks somewhat weak to me.","This paper studies online learning using SGD with momentum for nonstationary data. For the specific setting of linear regression with Gaussian noise and oscillatory covariate shift, a linear oscillator ODE is derived that describes the dynamics of the learned parameters. This then allows analysis of convergence/divergence of learning for different settings of the learning rate and momentum. The theoretical results are validated empirically, and are shown to generalize to other settings such as those with other optimizers (Adam) or other models (neural nets). The reviewers praise the clear writing and the rigorous and systematic analysis. 3 out of 4 reviewers recommend accepting the paper. The negative reviewer does not find the main contribution interesting and significant enough for acceptance",0.8495243787765503
"This paper is very well written, tackles an interesting area, proposes a novel calibration, and demonstrates the utility in empirical experiments. The proposed calibration results in a more intuitive interpretation than previous approaches. The experiments demonstrate clearly the value of matching the algrithm and metric. Histogram binning, within the appropriate algorithm, is shown to be a competitive post-hoc calibration technique. One of the three empirical observations on Page 9 states that the new TL-HB is the best performing method for 1-vs-rest ECE. In fact, it is the un-normalized variant of 1-vs-rest calibration that is shown","The paper studies the problem of multi-class calibration, proposing new notion of ""top-label calibration"", and presenting and comparing new algorithms for multi-class calibration. Reviewers generally found the paper to be well-written, and tackling a foundational problem. There were some questions regarding the experiments: (1) _Lack of explanation of why unnormalised beats normalised. _ One of the paper's main empirical findings is that using an unnormalised predictor with histogram binning (CW-HB) can significantly outperform a normalised one (N-HB). There is however limited discussion prior to this of why such behaviour is expected. (2) _Lack of comparison to isotonic regression",0.8512211441993713
"In general, the paper is written clearly with enough technical details to understand the arguments. The motivation to study data with anisotropic covariances is good. The findings on the error curve structures and the correspondence between phase transition and induced kernel matrix spectrum are interesting.","This paper extends recent and very active literature on analyzing learning algorithms in the simplified setting of Gaussian data and model weights, with the main generalization being to allow for non-isotropic covariance matrices. The main technical results seem to be correct and slightly novel, though reviewers feel they are not innovative or unexpected enough to stand on their own. However, the main contributions of the paper are then to interpret these results to give phenomenological results (regarding double descent, etc.), and reviewers were unanimously happy with these. In the end, all reviewers were positive about the paper. The largest reviewer criticisms of the paper were technical issues (ot31) and lack of context of recent literature (3RfG).",0.8493239879608154
"The paper proposes an approach to overcoming the so-called backfill problem when time-series data are revised to correct previous recorded values. The authors propose a recurrent neural network to carry out the task. The paper is well written and the problem is well presented, notation is defined carefully, and the model is described with enough detail. The authors carry out a comparative evaluation against several CDC-approved forecasting models showing convincing better results.","This paper introduces Back2Future, a deep learning approach for refining predictions when backfill dynamics are present. All reviewers agree on that the authors successfully motivate their work and introduce a topic of great interest, i. e. that of dealing with the effect of revising previously recorded data and its effect timeseries predictions. The reviewers also underline the strong and thorough experimental section. Among the reviews is also underlined the potential impact of the work for the research domain. Many thanks to the authors for replying to the minor concerns raised. I concur with the reviews and find this submission very interesting, convincing and thus recommend for accept. Thank you for submitting the paper to ICLR.",0.8567561507225037
"The paper makes a valuable contribution towards understanding the ingredients necessary for good kernel performance for image classification. The approximation results are somewhat difficult to understand, but a lot of discussion is provided to parse them. In general, what approach could help improve the computation of these hierarchical convolutional kernels. In the examples provided in this work, no architecture achieves better performance than the Myrtle kernel. The paper is very well written, with detailed and interesting discussions, which makes it a very pleasant read. I really appreciated that 1) the kernel models studied in this paper are motivated by simulation, showing that they match state-of-the-art performance for kernel","The paper addresses hierarchical kernels and provides an analysis of their RKHS along with generalization bounds and cases where improved generalization can be obtained. The reviewers appreciated the analysis and its implications. There were multiple concerns regarding presentation clarity, which the authors should address in the camera ready version.",0.8532826900482178
"This paper proposes a simple and elegant state representation method for learning and planning in the MiniGrid world. All the reviewers agree that this is an interesting and interesting idea. The main concern is that the presentation in the paper leave a lot to be desired in terms of positioning the paper with prior work. There is no mention of the neural network architectures for the VFs. The authors do not explicitly address this connection, and I would like to see them do that. I quite like the idea of action abstractions, or action oriented constructions of state abstractions, especially for robotic domains, and this paper does propose a simple but potentially","This paper is good but at a borderline. One reviewer increased the score during the discussions. However, no reviewer was in strong favor. So that this paper is still a borderline one, and it is up to the SAC to decide.",0.8421384692192078
"This paper presents the first non-trivial sublinear time result for L regression problem. The paper also presents a result for the general A case (where the improvement is about a quadratic improvement). The paper is pretty well-written (some minor typos at the end of this section). Most of my complaints are more from the more practical aspects of the results in the paper: (-) The improvements in this paper only take effect for d>n2/p, which for fixed p is still pretty large. The paper presents some motivation for Lp regression: it would be useful to clarify which of those need p>4.","Dear Authors, The paper was received nicely and discussed during the rebuttal period. There is consensus among the reviewers that the paper should be accepted: - The new result about query complexity of regression problem that the authors have added. Along with the result on for (noisy) Vandemonde matrix, these make the paper lie above the accept bar. - The authors have providing satisfying clarifications during the rebuttal that convinced reviewers to increase further their scores. The current consensus is that the paper deserves publication. Best AC",0.8302608728408813
"The paper contains useful ablation experiments that control for various aspects of the method. The presentation is very clear. The paper contains easy to understand diagrams and Algorithm 1 was particularly helpful for the training and inference procedure (and how they relate to each other). I believe it would be more useful to readers if the section can explain how all the works relate to each other. In general, there will be many programs that can satisfy the input-output examples, but only some of them may accurately reflect the user's intent.","This paper addresses the problem of program synthesis given input/output examples and a domain-specific language using a bottom-up approach. The paper proposes the use of a neural architecture that exploits the search context (all the programs considered so far and their execution results) to decide which program to evaluate next. The model is trained on-policy using beam-aware training and the method is evaluated on string manipulation and inductive logic programming benchmarks. The results show that the proposed method outperforms previous work in terms of the number of programs evaluated and accuracy. Overall, the reviewers found the paper to be well-written and the idea proposed to be significantly novel and interesting to be presented at the conference and I agree.",0.8452082872390747
"The main weakness of the paper is the lack of thorough benchmarking. For image data, it would be nice to see the benchmarking done on at least one more complex dataset (maybe CIFAR-10). One minor comment is that the authors should consider moving algorithm 1 to the main paper. The problem studied in this paper is important and needs to be solved in data synthesis. The editorial quality of this paper is not always satisfactory. It contains quite a lot of inconsistent/non-precise descriptions, as also reflected in the above comments.",The paper presents a new framework of synthesizing differential private data using deep generative models. Reviewers liked the significance of the problem. They raised some concerns which was appropriately addressed in the rebuttal. We hope the authors will take feedback into account and prepare a stronger camera ready version.,0.8546139597892761
"The authors show that adding divisive normalization in addition to another normalization technique (batch normalization) produces the best performing image classification model on two datasets (ImageNet, CIFAR-100) The authors perform an extensive set of visualization, representational, and Fourier analyses to understand why divisive normalization gives the above performance boost on image classification.","This paper explores addition of a version of divisive normalization to AlexNets and compares performance and other measures of these networks to those with more commmonly used normalization schemes (batch, group, and layer norm). Various tests are performed to explore the effect of their divisive normalization. Scores were initially mixed but after clarifications for design and experiment decisions, and experiments run in response to comments by the reviewers the paper improved significantly. While reviewers still had several suggestions for further improvements, after the authors' revisions reviewers were in favor of acceptance which I support.",0.8517276644706726
"The paper is well-written and clear. The experiments were easy to follow and the analysis was clear. The main findings related to underestimation, comparison of training-set and test-set dynamics during training, and dependence on training data were interesting and not obvious.","This paper presents a very interesting study of using an artificial language (generated using a specific algorithm via a transformer model) and training SOTA transformer and LSTM language models on that language; the authors show that these LMs underestimate the probability of sequences from this language and overestimate the probability of ill formed sentences, among other observations. This is a very interesting study that captures the behavior of recent LMs. All reviewers are supportive of accepting this paper and it is good to see the engagement between reviewers and authors of this paper.",0.8494972586631775
"This paper proposes a method to produce samples that are uniformly distributed on the learned manifold, regardless of the training set distribution. The method is interesting and theoretically well-motivated. The sampling algorithm itself is very straightforward. The authors use the colloquial understanding of ""uniform"" side-by-side with the differential geometric / measure theoretic understanding of ""uniform"". This creates the false impression that the present technique is capable of neutralizing the negative ""implications"" on fairness, data augmentation, anomaly detection, domain adaptation, and beyond. In addition, the provided samples of the generated images are not clear enough to provide a good justification for their","The paper proposes a simple method for uniform sampling from generative manifold using change of variables formula. The method works by first sampling a much larger number of samples (N) from uniform distribution in the latent space and then does sampling by replacement (using probability proportional to change in volume) to generate a smaller number of final samples (k  N) that are seen as approximately sampled from a uniform distribution from the generative manifold. Reviewers had some questions/concerns about the confusing language in the abstract and introduction around the use of the term ""uniform"" which the authors have addressed satisfactorily. Authors have also provided results on quality (FID metric) of the generated samples as asked by the reviewers.",0.8507765531539917
"This paper proposes a new neural contextual bandit algorithm. The proposed algorithm significantly reduces the computation costs when compared to existing neural contextual bandit algorithms. The authors show that their proposed algorithm outperforms the existing algorithms. The main weakness is that the algorithm proposed is not particularly novel. There is also some concern about the requirement on the width of the neural network in thm 4.4 being so large in order for the main O(sqrt(T) bound to hold, but the authors do at least provide some empirical evidence in the appendix that suggests the performance of their algorithm is not heavily reliant on very large values of the network width.","This paper tackles the neural contextual bandit problem, for which existing approaches consists rely on bandit algorithms based on deep neural networks to learn reward functions. In these existing strategies, exploration takes place over the entire network parameter space, which can be inefficient for the large-size networks typically used in NTK-based approaches. In this work, the authors address this by building on an existing technique of shallow exploration, which consists in exploring over the final layer of the network only, allowing to decouple the deep neural network feature representation learning from most of the exploration of the network parameters. More specifically, they propose a simple and effective UCB-based strategy using this shallow exploration scheme, for which they provide a",0.8471455574035645
"The proposed method is well-described and introduced experimental settings are properly designed with multiple public datasets. The experiments show that the performance of the method is comparable or slightly better than competitive baselines. The paper addresses the import issue of uncertainty, which can hugely affect real-world applications. The introduced experimental settings seem to be reasonable to show the effectiveness of its method in calculating prediction intervals and the OOD identification capability. I believe it will be better if the authors perform studies with different parameters and more datasets with different data structures (such as images or time-series data) to generalize their findings.","The paper proposes a novel method, PI3NN, for estimating prediction intervals (PIs) for quantifying the uncertainty of neural network predictions. The method is based on independently training three neural networks with different loss functions which are then combined via a linear combination where the coefficients for a given confidence level can be found by the root-finding algorithm. A specific initialization scheme allows to employ the method to OOD detection. Reviewers agreed on the importance of the problem of producing reliable confidence estimates. The proposed method addressed some of the limitations of the existing approaches, and reviewers valued that a theoretical as well as an empirical analysis is provided. On of the main criticisms was that the theoretical derivation of the method is based",0.8466320037841797
This paper presents a learnable similarity function that adaptively adjusts the weights of the similarity between one sample and the samples of some class. The experimental results of the proposed algorithm outperform that of the other comparable clustering algorithms.,"The authors provide a framework for unsupervised clarification based on minimizing a between-cluster discriminative similarity. It is more flexible than existing methods whose kernel similarity implicitly assumes uniform weights, and the authors connect to ideas such as max-margin and weighted kernel approaches. This yields a clustering algorithm naturally that alternates between updating class labels and similarity weights. Moreover the reviewers (and I) appreciate the analysis of generalization error through Rademacher complexity arguments and detailed author responses. I might add while the paper draws connections to weighted kernel methods and have since added references to sparse subspace clustering etc, there is recent interest in using similar arguments to derive error bounds and uniform concentration results for center-based methods that might",0.8504234552383423
