"The paper investigates an interesting problem, which is highly relevant for the ICLR community. The main contribution of the paper is empirical, the variants of the ACB algorithm admit a solid and novel design. All these support ACB as a viable exploration bonus for deep reinforcement learning.","This paper tackles the problem of exploration in Deep RL in settings with a large action space. To this end, the authors introduce an intrinsic reward inspired by the exploration bonus of LinUCB. This novel exploration method called anti-concentrated confidence bounds (ACB) provably approximates the elliptical exploration bonus of LinUCB by using an ensemble of least-squares regressors. This allows ACB to bypass costly covariance matrix inversion, which can be problematic for high-dimensional problems (hence allowing it to be used in large state spaces). Empirical experiments show that ACB enjoys near-optimal performance in linear stochastic bandits. However, experiments on Atari benchmark fail to show",0.8411008715629578
"The authors improve upon existing work to obtain a 2-Wasserstein mixing time bound of O(d0.5/epilson) for LMC, and show this is optimal. The article could be better written. For example, incorporating some of the remarks into the main text may read better. The main strength of the paper is to get sqrt(d) dependence on a dimension with not very restrictive assumptions. In my opinion, the linear growth condition of the third derivative could be discussed in more detail, to improve the presentation of the results.",This paper provides a near-optimal analysis of the unadjusted Langevin Monte Carlo (LMC) algorithm with respect to the W2 distance. The main statement is that the mixing time is  d1/2/eps under standard assumptions. The authors also give a nearly matching lower bound under these assumptions. The reviewers agreed that this is an interesting contribution obtained via non-trivial techniques. The consensus recommendation is to accept the paper.,0.8537102341651917
"This paper proposes a new learning method by revisiting the purpose of loss functions, which is to distinguish the performance of models. Hence, the authors aim to learn surrogate losses by making the surrogate losses have the same discriminability as the evaluation metrics. The proposed method can be widely applied to NLP and CV tasks, and its benefits seem significant according to the experiments. The authors conduct experiments on the synthetic and large-scale benchmark datasets, and gain significant improvements in performance and efficiency compared to existing surrogate loss learning methods.","The paper presents an approach to learn the surrogate loss for complex prediction tasks where the task loss is non-differentiable and non-decomposable. The novelty of the approach is to rely on differentiable sorting, optimizing the spearman correlation between the true loss and the surrogate. This leads to a pipeline that is simpler to integrate to existing works than approaches that try to learn a differentiable approximation to the task loss, and to better experimental results. The paper is well written and the approach clearly presented. The reviewers liked the simplicity of the approach and the promising experimental results on a variety of challenging tasks (human pose estimation and machine reading).",0.8658053874969482
This paper proposes a method to encode morphological information. The proposed approach is straightforward. The experiments show that the proposed approach outperformed competitive baselines such as SMP and AMORPHEUS. The reviewer has some concerns about the novelty of the paper. The paper is well-motivated in that structural and morphological information about the robot could help improve the performance in MTRL and transfer learning. The proposed method can still achieve good performance in MTRL because the training in MTRL allows the policy to overfit to the learnable positional embeddings. But the proposed embedding has limited generalization ability so it is not suitable for tasks like zero-shot policy,"This paper studies the role of positional and relational embedding s for multi-task reinforcement learning with transformer-based policies, The paper is well-motivated, the experiment shows its effectiveness against other competitive methods. In the rebuttal period, the authors solved most of the reviewsâ€™ questions such as novelty and ablation studies. There are still some concerns about the generalizability of this approach for other tasks and more experiments are needed.",0.865362823009491
The method has some great results and might really be the key to unlocking the lower precision. The paper is about from-scratch training to improve the performance to improve from-bit training. The authors propose a design methodology of NPU quantization. The authors show the superiority of the proposed metricization scheme. This reviewer is not sure whether the proposed method is good for ResNet-18.,"This paper introduces a method to determine which precision to use for the weights, as well as a quantisation method using hysteresis to improve performance with low-precision weights, including 4-bits. Reviewers tend to agree that the two points presented are useful and can have a large impact on the field. Generally, reviewers pointed out that motivations, notations and experimental studies could be improved. This has been partly addressed by the authors. I recommend to accept this paper for ICLR 2022.",0.8617965579032898
"This paper proposes a new deformed sampling module that explicitly downscales the image into target resolution. The proposed method is end-to-end trainable, and can be plugged into different backbone networks.","Overall, this paper receives positive reviews. The reviewers find the technical novelty and contributions are significant enough for acceptance at this conference. The authors' rebuttal helps address some issues. The area chair agrees with the reviewers and recommend it be accepted at this conference.",0.8385668396949768
"The paper provides a new view to parallelize the training task of machine learning models. The paper is based on solid techniques (multigrid reduction in time solver) that have been used in other domains (solving ordinary differential equations). The authors propose a novel parallel-in-time (PinT) training method based on a MGRIT solver for GRU networks with long sequences. The proposed algorithm enables the accelerated parallel training of GRUs on long sequence, which is a unique capability that permits growth in this dimension. The paper is well written and clear, especially the part of methodology. Overall, the paper is well written and clear,","This paper presents a way of using multigrid techniques to parallelize GRU networks across the time dimension. Reviewers are uniformly in favor of accepting the paper. The main strength is that the paper provides a new perspective on dealing with long input sequences by parallelizing RNNs across time. The main weaknesses are around the experiments: only CPU experiments are run, and sequences are not very long (max 128 length). All-in-all, though, it provides an interesting perspective that should be valuable to the community.",0.8608822226524353
"This paper proposes a sparse adversarial attack based on a random target image. The proposed methods are well-motivated and novel. The experiments are convincing and the experiment results show the effectiveness of the proposed attack. The main issue with this paper is the lack of an intuitive explanation as to why this attack is better at finding sparse and effective adversarial examples than previous work. I would have liked to see a more detailed algorithmic comparison with previous work. The proposed methods are well-motivated and novel. The paper is easy to follow for an adequately prepared reader. Prior work is sufficiently discussed. The amount of detail is good, it seems sufficient to reproduce","This paper introduces a technique to generate L0 adversarial examples in a black-box manner. The reviews are largely positive, with the reviewers especially commenting on the paper being well written and clearly explaining the method. The main drawbacks raised by the reviewers is that the method is not clearly compared to some prior work, but in the rebuttal the authors provide many of these numbers. On the whole this is a useful and interesting attack that would be worth accepting.",0.8664774894714355
"The paper makes nontrivial theoretical progress. The authors provided enough explanation about how this progress can be distinguished from other existing works, so the contribution looks to be unique. In Table 1&2, the comparisons of Top-1 prediction for 'Our methods' are missing. I recommend the author to compare with another L0 verification methods like https.openreview. net/pdf?id=HyeaSkrYPH.","Thank you for your submission to ICLR. The reviewers ultimately have mixed opinions on this paper, but reading in a bit more depth I don't feel that the critical comments raised by the sole negative reviewer really raise valid points. Specifically, the fact that this reviewer directly asks e. g. for comparisons to Levine and Feiz 2019, when the paper (before its revisions) contains an entire section devoted to exactly this comparison, strikes me as not sufficient for a thorough review. However, while I'm thus going to recommend the paper for acceptance (it does present a notable, if somewhat minor, advance upon the state of the art in randomized smoothing), I also feel the paper is generally rather",0.8204910755157471
This paper is an extension of previous theoretical results on SLTH from fully connected layers to convolutional layers. The main theorem is well supported by the empirical experiments.,"The paper presents interesting new results for pruning random convolutional networks to approximate a target function. It follows a recent line of work in the topic of pruning by learning. The results are novel, and the techniques interesting. There are some technical issues that are easy to fix within the camera ready timeline (see comments of reviewers below). I would also suggest refining the title of the paper: the lottery ticket hypothesis has an algorithmic component too, which clearly is not covered by existence results.",0.8588002324104309
"In terms of novelty, the sparse regression step is fairly well-known. The authors discuss the topic but it is not really clear. The authors mention this themselves, but any guidance on whether the entire mechanism need be restarted would be interesting.","The paper introduces a pipeline to discover PDEs from scarce and noisy data. Reviewers engaged in a very thoughtful discussion with the authors. I read the extensive rebuttal, and I believe the authors have addressed the major concerns claimed by the reviewers. I ask the authors to make sure to include all the changes and additional experiments in the camera-ready version.",0.8588513135910034
"The proposed method is novel, to the best of my knowledge. While both  -discounting and advantage weighting have been studied in a number of prior works, I am unaware of prior work that applies them to goal-conditioned behavior cloning methods. The paper is well written and the notation very easy to follow. The idea, although somewhat an obvious followup to GCSL, is well explained and analyzed, and experimental results are convincing. Overall I vote to accept this paper, but would appreciate responses from the authors on my questions.","The authors introduce a method that improves goal-conditioned supervised learning (GCSL) by iteratively re-weighting the experience by a variable that correlates with the number of steps till the desired goal. The reviewers mention that the authors focus on an important problem, their method is simple and the empirical results are significant. However, they do point several flaws of the paper, the main ones being questionable theoretical claims and the clarity of the presentation. After an extensive discussion, most reviewers agree that the paper should be accepted but I do encourage the authors to take into account the comments by the reviewers for the final version of the paper and make the theory more clear.",0.8629692196846008
The paper tackles an important and challenging problem faced in dimensionality reduction. The proposed method is simple and justified by existing research. The paper is hampered by a lack of notational clarity in essential sections that makes it difficult to determine the full contributions and impact of the proposed method.,"This paper proposes loss functions to encode topological priors during data embedding, based on persistence diagram constructions from computational topology. The paper initially had some expositional issues and technical questions, but the authors did an exceptional job of addressing them during the rebuttal period----nearly all reviewers raised their scores (or intended to but didn't update the numbers on their original reviews). The AC is willing to overlook some of the remaining questions. For example, concerns that topology isn't well known in the ICLR community (8muq) are partially addressed by the improved exposition (and it's OK to have technically sophisticated papers so long as some reviewers were able to evaluate them). And, future work can",0.845716118812561
"This paper proposes an algorithm that learns expressive graph representations. The proposed model is found to be very effective in graph isomorphism testing and in the detection of graph properties, while it outperforms the baselines on three real-world datasets.","This paper presents a neural version of individual-refinement (IR) architecture for improving the expressiveness of GNN in terms of isomorphism tests. As IR is the dominant approach of practical graph isomorphism tests, adapting IR to GNN is a novel and important idea. As IR suffers from the exponential number of branches, the paper adapts particle filtering algorithms to sample K paths to approximate the full version of the IR algorithm. Simulation and real-world datasets are used to demonstrate the improvement over base GNN. Strengths: + The paper is well written and easy to follow. + The originality of the paper is high since it is both technically rich. Adapting individual-refine",0.8623456954956055
"The authors provide theoretical support for the use of the pre-existing GIN model for ICA. They propose novel assumptions and prove this leads to identifiability. In particular, the main indeterminacy of a nonlinear ICA framework using volume-preserving is the rotation of latent variables. The authors further perform experiments to show that their method outperforms the state-of-the-art nonlinear ICA method iVAE.","This paper proposes an identifiable nonlinear ICA model based on volume-preserving transformations. The overall approach is very similar to the GIN method published @ ICLR 2020. There is a weak consensus among the reviewers that this paper has some merit, although none pushed for acceptance. After reviewing the paper myself, I agree that the contributions here appear to be incremental, but the results do push this growing field of identifiable latent variable models forward.",0.8724923133850098
The paper is well written and overall quite clear. The experiments were still with relatively small teams and with agent behavior largely coming from pre-trained RL policies. In RL the failures are seldom so consistent that unlearning would have such a low spread around the mean. Overall it's still difficult to say if the selected policies for testing are representative enough as say doing human evaluation where the style of play might be completely different.,"The paper presents a method for cooperative ad-hoc collaboration by learning latent representations of the teammates. The method is evaluated in three domains. All the reviewers agree that the method is novel and adds an interesting contribution to the important and difficult problem of the ad-hoc collaboration, making fewer assumptions about the team and the teammates. The next version of the paper should comment: - On the societal impact of the centralized training. - Wang et al, CoRL 2020, https://arxiv. org/abs/2003.06906, which addresses the cooperative tasks in the ad-hoc teams without privileged knowledge and assumptions about the teammates.",0.819940447807312
"The paper focuses on an important problem of activation normalization which to my knowledge has not yet been properly explored in the continual learning setting. The practicality and relevance of the proposed technique are high. The improvements offered by the method are mostly consistent between different tested settings, with few exceptions. The empirical evaluation provided in the paper is extensive and authors consider multiple important perspectives, such as the computational complexity of CN (the running time in Table 3), how it behaves in different CL settings, and how an ""oracle method"" performs (BN*). The paper does not provide the standard deviation of the results for the case of the COCOSeq benchmark.","The paper sheds light on issues with BN in continual learning and proposes a quite simple, which is a strength, solution to fix it. The Authors first draw attention to the fact that using recalculated moments boosts performance and reduces forgetting, which serves as an argument that at least partially BN contributes to catastrophic forgetting in continual learning. Given that BN remains quite important in certain application areas such as vision, it is a strong motivation for the paper. The experiments are thorough and clearly show that CN is a practically relevant alternative to BN in continual learning. One weakness of the paper is that the method is poorly motivated, and relatedly, it has quite limited novelty. CN combines the strengths and weaknesses of BN and",0.845694363117218
"This paper proposes a novel model for object-centric learning, based on an object-centric view and the dynamics of each object are treated unitarily. The theoretical analysis around the newly proposed equivariant layer is nice and useful. The evaluation only looks at a single simulated dataset. While these simulations are nice and insightful, I would have expected some real-world evaluation as well. The authors could have looked at some motion capture data where different parts of the human body could be treated as rigid-body constraints. For instance, the authors could have looked at some motion capture data where different parts of the human body could be treated as rigid","The manuscript develops a new kind of graph neural network (a Graph Mechanics Network; GMN) that is particularly well suited to representing and making predictions about physical mechanics systems (and data with similar structure). It does so by developing a way to build geometric constraints implicitly and naturally into the forward kinematics of the network, while still allowing for effective learning from data. The manuscript proves some essential properties of the new architecture and runs experiments both with simulated particles, hinges, sticks (and their combination), as well as with motion capture data. Reviewers were generally impressed by the writing and clarity of the work, as well as the main results. In addition, in those cases where reviewers thought that the experiments were",0.831382155418396
"This paper proposes a new benchmark and metric to measure the retention of time-invariant knowledge, updated knowledge, and new knowledge. The proposed CKL problem is quite interesting and important. The benchmark is useful and the proposed FUAR metric is technically sound. The experiments are very limited to the LAMA probing which does not necessarily connect to real downstream applications of these LMs. The experimental results will be more convincing if more pre-trained language models (such as GPT) are included. The authors did not show experiments or analysis in such a setting, where the new task has some ""task similarity"" with the learned tasks.","The paper introduces the problem of continual knowledge (language) learning. The authors point out the interesting duality between continual learning and knowledge learning where: in knowledge learning one must avoid forgetting time-invariant knowledge (avoid forgetting in CL), be able to acquire new knowledge (learn new tasks in CL), and replace outdated knowledge (a form of forgetting and re-learning or adaptation). In their paper, the authors develop an initial benchmark for the task along with a set of baselines and provide empirical studies. The initial reviews were quite mixed. The reviewers seem to agree this work studies an interesting and fairly novel direction for continual learning of language. However, the reviewers did not agree on whether this initial stab",0.8498232960700989
"The paper proposes to use GAN to create an inverse function to detect the pattern and severity of disease from real data. The reasoning behind the regularizations is overall reasonable. There could be more explanation, however, on why double decomposition is a good idea for the model. Regarding the experiment with simulated data, it is hard to understand why the number of patterns were chosen to be 3, unlike 2 which was suggested to be optimal from the real data. The paper also compares between other methods, without a reasonable explanation on why they were selected for comparison. Other references on cases where these approaches were used for the same goal would be","The authors present a GAN for learning a continuous representation of disease-related image patterns from regional volume information generated from structural MRI images. The reviewers find the problem relevant and appreciate the proposed solution. They find the paper well-written and find the empirical results on Alzheimer brain MRIs relevant for the neuroscience community. The overall objective function includes several hyper-parameters. As pointed out as the main weak point by multiple reviewers this may hint at overengineering/overfitting to a data set. However, the reviewers also mention that the regularizers are all sufficiently well-motivated in the paper and the author response. Reviewers highlight comparisons on the real data as a strong result demonstrating that Surreal GAN",0.8491945266723633
"The paper proposes a semi-supervised reward learning pipeline to reduce reward engineering efforts, which is an important topic. The paper is well organized and easy to follow. The proposed method is motivated by the success of data augmentation in the supervised learning area. The authors use a preference-based reinforcement learning method, which is based on a surrogate reward model.","The topic of learning reward functions from preferences and how to do this efficiently is of high interest to the ML/RL community. All reviewers appreciate the suggested technical approach and the thorough evaluations that demonstrate clear improvements. While the technical novelty of the paper is not entirely compelling, all reviewers recommend acceptance of the paper.",0.8680389523506165
The paper is well-written and motivates the choice of the linear transition map from theoretical prospective. The paper provides extensive ablation studies on their modelling choices as well as the snippet of the code for the model. The authors may consider to extend this part to probabilistic cases.,"The paper got four accepts (after the reviewers changed their scores), all with high confidences. The theories are complete and the experiments are solid. The AC found no reason to overturn reviewers' recommendations. However, the AC deemed that all the pieces are just routine, thus only recommended poster.",0.8368837237358093
"This paper tackles an important problem and provides a convincing demonstration that current SOTA models are susceptible to reliance on spurious correlation in the training set. I detail key strengths, weaknesses, and additional questions below.","This paper presents a new method to decrease the supervision cost for learning spurious attributes using worst-group loss minimization. Their method uses samples both with and without spurious attribute annotations to train a model to predict the spurious attribute, then use the pseudo-attribute predicted by the trained model as supervision on the spurious attribute to train a new robust model having minimal worst-group loss. The experiments show promising results in this domain for reducing annotation cost. The reviewers vote to accept the paper, and some of them increased their scores during the discussions since the authors have addressed their concerns.",0.8510436415672302
The paper shows improved performance over 2 recent baselines. The proposed approach is generally faster. The paper also includes a visualization of the latent space colored by objective prediction scores to motivate the concatenation of the predicted objective to the embeddings towards clustering.,"This paper presents a conditional variational autoencoder (CVAE) approach to solve an instance of stochastic integer program (SIP) using graph convolutional networks. Experiments show that their method achieves high quality solutions with high performance. It holds merit as an interesting novel application of CVAEs to the ML for combinatorial optimization literature, as well as for the nice empirical results which show a very nice improvement. Two reviewers had a concern that the contribution is a bit narrowly focused toward MILP-focused journal rather than a general-purpose ML conference since the core contribution is the novel application. On the other hand, they believe that combinatorial optimization has received growing interest from the ML community in recent years. All",0.8261153697967529
