"The paper investigates an interesting problem, which is highly relevant for the ICLR community. All these support ACB as a viable exploration bonus for deep reinforcement learning. The paper does not provide any empirical evidence that supports such a performance gain. The paper is very well-written and straightforward to follow. It is also not clear how the current work improves upon exploration schemes proposed in Kveton et al.","This paper tackles the problem of exploration in Deep RL in settings with a large action space. To this end, the authors introduce an intrinsic reward inspired by the exploration bonus of LinUCB. This novel exploration method called anti-concentrated confidence bounds (ACB) provably approximates the elliptical exploration bonus of LinUCB by using an ensemble of least-squares regressors. This allows ACB to bypass costly covariance matrix inversion, which can be problematic for high-dimensional problems (hence allowing it to be used in large state spaces). Empirical experiments show that ACB enjoys near-optimal performance in linear stochastic bandits. However, experiments on Atari benchmark fail to show",0.8390005826950073,0.360483817756176
"This is an original and significant contribution. I thank the authors for their article, which addresses the important topic of analytically understanding the convergence of the unadjusted Langevin Monte Carlo (LMC) algorithm.",This paper provides a near-optimal analysis of the unadjusted Langevin Monte Carlo (LMC) algorithm with respect to the W2 distance. The main statement is that the mixing time is  d1/2/eps under standard assumptions. The authors also give a nearly matching lower bound under these assumptions. The reviewers agreed that this is an interesting contribution obtained via non-trivial techniques. The consensus recommendation is to accept the paper.,0.8796700835227966,0.48669622987508776
"This paper proposes a method to improve the performance of the loss function. The proposed approach is well motivated and makes sense. The problem study here is also essential and could be of interest to a large audience, as the loss function is fundamental in almost all machine learning tasks.","The paper presents an approach to learn the surrogate loss for complex prediction tasks where the task loss is non-differentiable and non-decomposable. The novelty of the approach is to rely on differentiable sorting, optimizing the spearman correlation between the true loss and the surrogate. This leads to a pipeline that is simpler to integrate to existing works than approaches that try to learn a differentiable approximation to the task loss, and to better experimental results. The paper is well written and the approach clearly presented. The reviewers liked the simplicity of the approach and the promising experimental results on a variety of challenging tasks (human pose estimation and machine reading).",0.8592716455459595,0.46215432584285737
"This paper proposes a graph-based relational embedding approach to encode morphological information. The reviewers agree that the paper is well-organized and easy to follow. The major weakness of this paper is the experimental evaluation. I would recommend 10 seeds. The proposed approach is straightforward., 2020]. I would recommend 10 seeds. The paper is well-organized and easy to follow. The reviewers agree that the paper is well-organized and easy to follow. I would recommend 10 seeds. The paper is well-organized and easy to follow. The reviewers agree that the paper is well-organized and easy to follow. I would recommend 10 seeds.","This paper studies the role of positional and relational embedding s for multi-task reinforcement learning with transformer-based policies, The paper is well-motivated, the experiment shows its effectiveness against other competitive methods. In the rebuttal period, the authors solved most of the reviewsâ€™ questions such as novelty and ablation studies. There are still some concerns about the generalizability of this approach for other tasks and more experiments are needed.",0.8309174180030823,0.3606373071670532
"The paper proposes a method to train the neural network from scratch while all the values are in the network. The paper is well-founded and the ideas are well-founded and useful. The method has some great results and might really be the key to lower precision. In Section 2, many notations are unclear. The method has some great results and might really be the key to lower precision. In Table 4, many notations are unclear. The method has some great results and might really be the key to lower precision. In Section 2, many notations are unclear. The method has some great results and might really be the key","This paper introduces a method to determine which precision to use for the weights, as well as a quantisation method using hysteresis to improve performance with low-precision weights, including 4-bits. Reviewers tend to agree that the two points presented are useful and can have a large impact on the field. Generally, reviewers pointed out that motivations, notations and experimental studies could be improved. This has been partly addressed by the authors. I recommend to accept this paper for ICLR 2022.",0.8356500864028931,0.36782635218567317
This paper proposes a new deformed sampling module that explicitly downscales the image into target resolution. The paper is well motivated based on detailed description of the limitations of the closest recent work.,"Overall, this paper receives positive reviews. The reviewers find the technical novelty and contributions are significant enough for acceptance at this conference. The authors' rebuttal helps address some issues. The area chair agrees with the reviewers and recommend it be accepted at this conference.",0.8425604104995728,0.35563525557518005
The paper provides a new view to parallelize the training task of machine learning models. There were some minor grammatical issues; careful copy-editing is recommended.,"This paper presents a way of using multigrid techniques to parallelize GRU networks across the time dimension. Reviewers are uniformly in favor of accepting the paper. The main strength is that the paper provides a new perspective on dealing with long input sequences by parallelizing RNNs across time. The main weaknesses are around the experiments: only CPU experiments are run, and sequences are not very long (max 128 length). All-in-all, though, it provides an interesting perspective that should be valuable to the community.",0.8592511415481567,0.40374868363142014
"The paper is well-written and the results are solid, and experiments are carried out on vision datasets and models of interest. The attack is both sparse and effective. So I am wondering how the scaling of SparseEvo is against the big images.","This paper introduces a technique to generate L0 adversarial examples in a black-box manner. The reviews are largely positive, with the reviewers especially commenting on the paper being well written and clearly explaining the method. The main drawbacks raised by the reviewers is that the method is not clearly compared to some prior work, but in the rebuttal the authors provide many of these numbers. On the whole this is a useful and interesting attack that would be worth accepting.",0.8530669212341309,0.3943832665681839
"The paper presents a new method for learning graph neural networks and 3D deep learning. The authors introduce top k predictions rather than top 1 prediction, which is an interesting contribution which extends the applicability of randomized ablation (i. l0 smoothing)","Thank you for your submission to ICLR. The reviewers ultimately have mixed opinions on this paper, but reading in a bit more depth I don't feel that the critical comments raised by the sole negative reviewer really raise valid points. Specifically, the fact that this reviewer directly asks e. g. for comparisons to Levine and Feiz 2019, when the paper (before its revisions) contains an entire section devoted to exactly this comparison, strikes me as not sufficient for a thorough review. However, while I'm thus going to recommend the paper for acceptance (it does present a notable, if somewhat minor, advance upon the state of the art in randomized smoothing), I also feel the paper is generally rather",0.8254969120025635,0.27883007129033405
This paper is an extension of previous theoretical results on SLTH from fully connected layers to convolutional layers. The paper is well written and easy to follow. The proving technique is similar to that used in Malach et al.,"The paper presents interesting new results for pruning random convolutional networks to approximate a target function. It follows a recent line of work in the topic of pruning by learning. The results are novel, and the techniques interesting. There are some technical issues that are easy to fix within the camera ready timeline (see comments of reviewers below). I would also suggest refining the title of the paper: the lottery ticket hypothesis has an algorithmic component too, which clearly is not covered by existence results.",0.8623198866844177,0.3352450807889302
"The paper is reasonably written from a technical perspective. The written English language needs to be improved. The authors mention this themselves, but any guidance on whether the entire mechanism need be restarted (with different parameters) or some of the work can be salvaged would be interesting. The role of recurrent network in 1b is unclear. and DAVIES, M. many works attempt to relieve the pain. I can see that for the experiments and parameters reported in Section 4, the proposed algorithm returns better qualitative results. This choice needs to be justified adequately. I can see that for the experiments and parameters reported in Section 4, the proposed algorithm returns better","The paper introduces a pipeline to discover PDEs from scarce and noisy data. Reviewers engaged in a very thoughtful discussion with the authors. I read the extensive rebuttal, and I believe the authors have addressed the major concerns claimed by the reviewers. I ask the authors to make sure to include all the changes and additional experiments in the camera-ready version.",0.8422332406044006,0.2879720793830024
"The paper introduces a value function, which significantly increases the complexity of the method, and is arguably the most important feature of goal-conditioned behavior cloning methods., Schwarzer, M. In NeurIPS, 2017, July. I put some examples at the end of this section. I was confused about the difference between GoalBC, Goal BCQ, and Goal CQL. For example, is Goal-CQL designed so that Q function reflects the marginal data collection policy or the goal-conditioned data collection policy? (i. 2), Sun, P., Courville, A. ""extremely sparse"" -> ""sparse","The authors introduce a method that improves goal-conditioned supervised learning (GCSL) by iteratively re-weighting the experience by a variable that correlates with the number of steps till the desired goal. The reviewers mention that the authors focus on an important problem, their method is simple and the empirical results are significant. However, they do point several flaws of the paper, the main ones being questionable theoretical claims and the clarity of the presentation. After an extensive discussion, most reviewers agree that the paper should be accepted but I do encourage the authors to take into account the comments by the reviewers for the final version of the paper and make the theory more clear.",0.8239314556121826,0.29539390041359836
"The paper presents a novel contribution that can lead to practical applications in areas that can benefit from better representation embeddings. The authors acknowledged this by adding Appendix A, but many points are not sufficiently detailed in there either. The empirical results demonstrate the method improves qualitative results and emphasise that topological optimisation of the embedding space need not enforce any sensible separation of the data.","This paper proposes loss functions to encode topological priors during data embedding, based on persistence diagram constructions from computational topology. The paper initially had some expositional issues and technical questions, but the authors did an exceptional job of addressing them during the rebuttal period----nearly all reviewers raised their scores (or intended to but didn't update the numbers on their original reviews). The AC is willing to overlook some of the remaining questions. For example, concerns that topology isn't well known in the ICLR community (8muq) are partially addressed by the improved exposition (and it's OK to have technically sophisticated papers so long as some reviewers were able to evaluate them). And, future work can",0.8394100069999695,0.3851947233080864
"This paper presents a new method for learning graph embeddings, called PF-GNN. It is used in graph isomorphism testing and in the detection of graph properties, and it outperforms the baselines on three real-world datasets. The proposed model is T times deeper and larger than base model, and K path sampling needs K times larger memory for parallel computation. The authors perform an extensive empirical evaluation of PF-GNN on both synthetic and real-world tasks. The paper is well written and easy to follow. I am not sure though how useful the bound provided in Theorem 2 could be in practice.","This paper presents a neural version of individual-refinement (IR) architecture for improving the expressiveness of GNN in terms of isomorphism tests. As IR is the dominant approach of practical graph isomorphism tests, adapting IR to GNN is a novel and important idea. As IR suffers from the exponential number of branches, the paper adapts particle filtering algorithms to sample K paths to approximate the full version of the IR algorithm. Simulation and real-world datasets are used to demonstrate the improvement over base GNN. Strengths: + The paper is well written and easy to follow. + The originality of the paper is high since it is both technically rich. Adapting individual-refine",0.8671491146087646,0.4923745784021559
The paper proposes a framework for the analysis of a simple triangle dataset. The authors propose two novel identifiability theorems. The main contribution is that under a few more conditions in addition to the volume preserving mixing function the true sources can be identified. The authors do not make clear why this is necessary or desirable. I believe the appendix should be separately provides as supplementary material.,"This paper proposes an identifiable nonlinear ICA model based on volume-preserving transformations. The overall approach is very similar to the GIN method published @ ICLR 2020. There is a weak consensus among the reviewers that this paper has some merit, although none pushed for acceptance. After reviewing the paper myself, I agree that the contributions here appear to be incremental, but the results do push this growing field of identifiable latent variable models forward.",0.8531896471977234,0.3333504363894463
The paper is well written and overall quite clear. It seems like the main claims to verge to originality on the fact that ODITS: doesn't require pre-defining agent types is able to adapt in an online fashion to changing and unseen agents/situations is able to deal with partially observable environments.,"The paper presents a method for cooperative ad-hoc collaboration by learning latent representations of the teammates. The method is evaluated in three domains. All the reviewers agree that the method is novel and adds an interesting contribution to the important and difficult problem of the ad-hoc collaboration, making fewer assumptions about the team and the teammates. The next version of the paper should comment: - On the societal impact of the centralized training. - Wang et al, CoRL 2020, https://arxiv. org/abs/2003.06906, which addresses the cooperative tasks in the ad-hoc teams without privileged knowledge and assumptions about the teammates.",0.8206380009651184,0.27531218466659385
"The paper considers the role of normalization on the role of batchnorm. The reviewers found the paper to be well-motivated and well-written. Overall, the reviewers found the paper to be well-motivated and well-written. There were some concerns regarding the experimental section of the paper. Overall, the reviewers found the paper to be well-motivated and well-written. There were some concerns regarding the experimental section of the paper. Overall, the reviewers found the paper to be well-motivated and well-written. There were some concerns regarding the experimental section of the paper. Overall, the reviewers found the paper to be well","The paper sheds light on issues with BN in continual learning and proposes a quite simple, which is a strength, solution to fix it. The Authors first draw attention to the fact that using recalculated moments boosts performance and reduces forgetting, which serves as an argument that at least partially BN contributes to catastrophic forgetting in continual learning. Given that BN remains quite important in certain application areas such as vision, it is a strong motivation for the paper. The experiments are thorough and clearly show that CN is a practically relevant alternative to BN in continual learning. One weakness of the paper is that the method is poorly motivated, and relatedly, it has quite limited novelty. CN combines the strengths and weaknesses of BN and",0.8174865245819092,0.3922143284645345
"The paper proposes a new method for learning the dynamics of objects. The proposed method uses an object-centric view and uses the dynamics of each object are treated unitarily. The reviewers found the paper to be well-written and well-motivated. Overall, the reviewers found the paper to be well-written and well-motivated. Overall, the reviewers found the paper to be well-written and well-motivated. The authors could have looked at some motion capture data where different parts of the human body could be treated as rigid-body constraints. Overall, the reviewers found the paper to be well-written and well-motivated.","The manuscript develops a new kind of graph neural network (a Graph Mechanics Network; GMN) that is particularly well suited to representing and making predictions about physical mechanics systems (and data with similar structure). It does so by developing a way to build geometric constraints implicitly and naturally into the forward kinematics of the network, while still allowing for effective learning from data. The manuscript proves some essential properties of the new architecture and runs experiments both with simulated particles, hinges, sticks (and their combination), as well as with motion capture data. Reviewers were generally impressed by the writing and clarity of the work, as well as the main results. In addition, in those cases where reviewers thought that the experiments were",0.8404743671417236,0.45574786237307957
The proposed FUAR metric is technically sound. It basically only considers a single corpus for updating the knowledge of previously learned LMs. It's also hard to justify whether such methods can maintain performance in general NLP tasks.,"The paper introduces the problem of continual knowledge (language) learning. The authors point out the interesting duality between continual learning and knowledge learning where: in knowledge learning one must avoid forgetting time-invariant knowledge (avoid forgetting in CL), be able to acquire new knowledge (learn new tasks in CL), and replace outdated knowledge (a form of forgetting and re-learning or adaptation). In their paper, the authors develop an initial benchmark for the task along with a set of baselines and provide empirical studies. The initial reviews were quite mixed. The reviewers seem to agree this work studies an interesting and fairly novel direction for continual learning of language. However, the reviewers did not agree on whether this initial stab",0.8347424864768982,0.28135433668891585
"This paper proposes an inverse function to detect the pattern and severity of disease from real data. Is it a mistake?. The baseline that the authors compared against are not very competitive. Additionally, there are words that gradient clipping is a better way than weight clipping to ensure Lipschitz continuity.","The authors present a GAN for learning a continuous representation of disease-related image patterns from regional volume information generated from structural MRI images. The reviewers find the problem relevant and appreciate the proposed solution. They find the paper well-written and find the empirical results on Alzheimer brain MRIs relevant for the neuroscience community. The overall objective function includes several hyper-parameters. As pointed out as the main weak point by multiple reviewers this may hint at overengineering/overfitting to a data set. However, the reviewers also mention that the regularizers are all sufficiently well-motivated in the paper and the author response. Reviewers highlight comparisons on the real data as a strong result demonstrating that Surreal GAN",0.8463617563247681,0.28691695311239784
This paper focuses on preference-based RL that uses trajectory-wise comparison queries to guide the learning procedure. The paper proposes a semi-supervised reward learning pipeline aiming to reduce reward engineering efforts.,"The topic of learning reward functions from preferences and how to do this efficiently is of high interest to the ML/RL community. All reviewers appreciate the suggested technical approach and the thorough evaluations that demonstrate clear improvements. While the technical novelty of the paper is not entirely compelling, all reviewers recommend acceptance of the paper.",0.8606956005096436,0.3750459452470144
"The paper presents a strong theory regarding contractive linear maps as well as the existence of inverses. It is a bit odd to compare the CGS across the number of heads, while GNN results are provided for a different number of message-passing layers.","The paper got four accepts (after the reviewers changed their scores), all with high confidences. The theories are complete and the experiments are solid. The AC found no reason to overturn reviewers' recommendations. However, the AC deemed that all the pieces are just routine, thus only recommended poster.",0.8341716527938843,0.2800816185772419
This paper proposes a method to identify and upweight samples from minority groups. The authors also analyze the pseudo labeling process of SSA to verify the adaptive thresholding is useful. It is not clear why the supervised contrastive learning part is needed in this work. Some experiments seem not relevant to the problem this paper aims to solve.,"This paper presents a new method to decrease the supervision cost for learning spurious attributes using worst-group loss minimization. Their method uses samples both with and without spurious attribute annotations to train a model to predict the spurious attribute, then use the pseudo-attribute predicted by the trained model as supervision on the spurious attribute to train a new robust model having minimal worst-group loss. The experiments show promising results in this domain for reducing annotation cost. The reviewers vote to accept the paper, and some of them increased their scores during the discussions since the authors have addressed their concerns.",0.8534069657325745,0.3562389276921749
The paper introduces SIPs and the literature towards machine learning for integer programming. The paper shows improved performance over 2 recent baselines. The paper also includes a visualization of the latent space colored by objective prediction scores to motivate the concatenation of the predicted objective to the embeddings towards clustering.,"This paper presents a conditional variational autoencoder (CVAE) approach to solve an instance of stochastic integer program (SIP) using graph convolutional networks. Experiments show that their method achieves high quality solutions with high performance. It holds merit as an interesting novel application of CVAEs to the ML for combinatorial optimization literature, as well as for the nice empirical results which show a very nice improvement. Two reviewers had a concern that the contribution is a bit narrowly focused toward MILP-focused journal rather than a general-purpose ML conference since the core contribution is the novel application. On the other hand, they believe that combinatorial optimization has received growing interest from the ML community in recent years. All",0.8353742957115173,0.3745268496374289
"This paper presents an analysis of multi-class classification for kernel regression. The main novelty of the manuscript is the characterization of the double descent behavior of ridge (or ridgeless) regression based multi-class classification in terms of its closed form leave-one-out formulations and spectral decomposition of the kernel matrix.100. The various forms of leave-one-out computations for ridge regression are quite well known and therefore do not provide that much novelty, see http.128. g. ist.",This paper proposes to use LOO to characterize the generalization error of neural networks via the connection between NN and kernel learning. The reviewers find the new results interesting. The meta reviewer agrees and thus recommend acceptance.,0.8458376526832581,0.27083987121780717
