"The paper makes an insightful connection between X3d's conv block and transformer block, and build a unified computational block. On the standard video action recognition benchmark, the proposed method achieves SOTA result, which is impressive.","The paper presents an approach for spatio-temporal representation learning using Transformers. It introduces a particular architecture design, which shows an impressive computational efficiency. The reviewers agree that the experimental results are strong, and unanimously recommend the paper for acceptance. The reviewers find their concerns regarding the details of the approach/setting address after the authors' response. We recommend accepting the paper.",0.8576006293296814,0.3285018399357796
"The paper shows that the proposed algorithm outperforms existing imitation learning methods in terms of predictive power. The authors perform no ablation testing on model features. However, what would also have been interesting is to see success/failure of existing imitation learning methods for gaining insight into decision making process of organ donation acceptance decision.","All three reviewers suggest acceptance of the paper. The authors study an interesting problem (understanding non-stationary and reactionary policies) and propose a solution to the problem which compares favorably to baselines in experiments. However, some of the reviewers also criticize unclarities in the presentation of the paper and the made assumptions. The authors clarified those points quite well in their rebuttal. Further concerns regarded design decisions and the comparison to failure cases of baselines. The authors addressed those in their rebuttal and promised to include corresponding material in their updated paper. Hence I am suggesting acceptance of the paper. Nevertheless, I would like to urge the authors to carefuly revise their problem presentation in the paper in order to improve clarity",0.8355146646499634,0.2832034432018796
"The paper analyzed the proposed non-linear multi-mode tensor factorization algorithms, and the theoretical results help to understand the gap between the linear and non-linear factorization gap.","The paper considers matrix and tensor factorization, and provides a bound on the excess risk which is an improved bound over the bounds for ordinary matrix factorization. The authors also show how to solve the model with standard gradient-based optimization algorithms, and present results showing good accuracy. The method can be a bit slow but this depends a bit on the number of iterations, and in general it achieves better accuracy in a similar amount of time to other baseline algorithms. The reviewers raised a few points, such as jdoi noting the tensor experiments were for small tensors and should include the method Costco as well; other reviewers mentioned more methods as well. The authors seemed to address most of these concerns in the",0.8610853552818298,0.47355740517377853
"The manuscript is well presented and clear, and the details on experiments are thorough in the main text and would be easy to reproduce, the appendix is also clear and to the point.","This paper proposes a novel method for training neural rough differential equations, a recent model for processing very long time-series data. The method involves a lower-dimensional embedding of the log-signature, which is obtained via pretrained autoencoder to reduce overhead. The results show significant and consistent improvements over previous methods on long time-series data. Overall, the reviewers and I all agree that this paper offers a novel and impactful contribution leading to significant improvements over previous state-of-the-art methods for training neural rough differential equations. I recommend acceptance.",0.8319584131240845,0.25901697129011153
"The paper focuses on the particularly interesting class of games known hidden convex-concave games., EG, OGDA, pseudo inverse Fisher) be able to recover from the gradient of  the information in the gradient of F and G. 2021). The paper fails to convince about the originality and the significance of the results. However, it is unclear how this result relates and compares to the existing ones in the context of HCC; e. Solving Min-Max Optimization with Hidden Structure via Gradient Descent/Ascent. There have been some techniques to address such issues in the literature (e. This would require the preconditioning matrix","The paper studies the convergence of a generalized gradient descent ascent (GDA) flow in certain classes of nonconvex-nonconcave min-max setups. While the nonconvex-nonconcave setups are computationally intractable and GDA is known to converge even in some convex-concave setups, the paper argues that (generalized) GDA can converge on what is dubbed ""Hidden Convex-Concave Games"" in the paper and argued that it contains GANs as a special case. The reviewers all found the paper interesting and a worthy contribution to the literature on nonconvex-nonconcave zero-sum games. Main concerns expressed by the reviewers were w. r. t",0.8354038000106812,0.40100991051821483
"This paper proposes a neural network algorithm for offline offline data. The proposed algorithm is called NeuraLCB. The reviewers found the paper to be a strong contribution. However, the main and several lemmas do not hold. I am willing to increase my score for this paper.5 should still hold inequality. The reviewers found the paper to be a strong contribution. However, the main and several lemmas do not hold. I am willing to increase my score for this paper.5 should still hold inequality. The reviewers found the paper to be a strong contribution. However, the main and several lemmas do not","This paper studies off-policy learning of contextual bandits with neural network generalization. The proposed algorithm NeuraLCB acts based on pessimistic estimates of the rewards obtained through lower confidence bounds. NeuraLCB is both analyzed and empirically evaluated. This paper received four borderline reviews, which improved during the rebuttal phase. The main strengths of this paper are that it is well executed and that the result is timely, considering the recent advances in pessimism for offline RL. The weakness is that the result is not very technically novel, essentially a direct combination of pessimism with neural networks. This paper was discussed and all reviewers agreed that the strengths of this paper outweigh its weaknesses. I agree and recommended this paper to be accepted",0.8350511789321899,0.4979059316217899
"The paper presents a new method for multi-agent motion prediction. The paper is well written and easy to follow. The experiments demonstrate the ideas validity, although there is definitely room for further strengthening.","This paper proposes a joint multi-agent trajectory prediction framework for multiple agents using a ""heatmap"" estimation approach employing a hierarchical strategy and sparse image generation for for efficient inference. The method takes a set of predicted trajectories for each agent produces reorderings. The work yields a top result on a competitive leaderboard. While multiple reviewers were initially concerned about the paper not making a single major contribution, the author response discussion helped to clear up the degree of novelty. Further experiments provided during the review also led to multiple reviewers increasing their score. In the end, all reviewers recommend acceptance of this paper. As such the AC recommends accepting this paper.",0.8628924489021301,0.4295027160218784
"The authors do a great job presenting the different aspects of the evaluation and explaining why they are meaningful. It is time for such tracks in machine learning main conferences, especially for subfields which deal with fundamental issues such as agreeing on definitions and evaluations.","This review paper presents a way of comparative assessment of continual learning. Reviewers all agreed that this work is interesting, unique with comprehensive coverage of the CL space. The proposed categorization, CLEVA-Compass, and its GUI have great potential to facilitate future CL work.",0.8499199151992798,0.35216570645570755
"The paper provides a thorough empirical investigation of their algorithm, which shows the advantage of  -SDDP., Sec 2. ssrn. -There are some strong empirical results, showing significantly improved optimization times with little reduction in performance.","This paper applies deep learning to a problem from OR, namely multistage stochastic optimization (MSSO). The main contribution is a method for learning a neural mapping from MSSO problem instances to value functions, which can be used to warm-start the SDDP solver, a state-of-the-art method for solving MSSO. The method is tested on two typical OR problems, inventory control and portfolio management. The reviewers think that the idea is interesting, the empirical results are impressive, and the paper is well-written. However, there are reservations on its relevance to the ICLR community.",0.8442674279212952,0.34823375393946965
"The paper studies an important problem for imitation learning with only offline data. ICML, 2021. The proposed problem is a natural and practical extension of the offline IL problem. These recent works should be discussed in the paper.","The paper presents a method for learning sequential decision making policies from a mix of demonstrations of varying quality. The reviewers agree, and I concur, that the method is relevant to the ICLR community. It is non-trivial, the empirical evaluations and theoretical analysis are rigorous, resulting in a novel method that produces near optimal policies from more readily available demonstrations. The authors revised the manuscript to reflect the reviewers' comments.",0.8584696650505066,0.2850929880514741
"The authors explicitly acknowledge this on multiple occasions and point out why the differences matter. The proposed method could directly start with a scaffold, which is usually used in practical drug molecule discovery. The experiments show the MoLeR could generate high quality molecules comparison to a few prior methods.","Most reviewers were positive about the paper, seeing that the proposed method is practical and has convincing experimental performances. One reviewer was a bit negative and raised questions about clarity. After the authors responded, the negative reviewer didn't respond further. After reviewing all the comments, the AC feels that there is enough support from reviewers to accept this paper.",0.8547853231430054,0.30285017006099224
"This paper proposes an improved version of the K-medoids method in which the computational complexity with respect to sample size is improved from n2 to n3/2.strength. In the conventional active learning methods, it has been the mainstream to select the input of the target domain to be labeled based on the output of the domain trained at the same time. The proposed algorithm can be interpreted as a clustering algorithm that minimizes the sum of the distances between the data.","This paper deals with the important topic of active transfer learning. All reviewers agree that while the paper presents some shortcomings, it is considered to be a worth contribution.",0.8437930941581726,0.2152056035896142
The paper is well written and is easy to follow. The motivation and methodology is stated clearly. The paper is well written and is easy to follow. Multiple benchmarks are used to evaluate the method.,"This paper proposes a new method for domain generalization. The main idea is to encourage higher inner-product between gradients from different domains. Instead of adding an explicit regularizer to encourage this, authors propose an optimization algorithm called Fish which implicitly encourages higher inner-product between gradients of different domains. Authors further show their proposed method is competitive on challenging benchmarks such as WILDS and DomainBed. Reviewers all found the proposed algorithm novel and expressed that the contributions of the paper in terms of improving domain generalization is significant. A major issue that came up during the discussion period was that we realized that the presented results on WILDS benchmark are misleading. In particular, the following statements in the manuscript are false because on """,0.8373258709907532,0.33156118435519083
The paper is well written and the ideas and experiments are presented with clarity. The paper is well written and the ideas and experiments are presented with clarity. The paper is well written and the ideas and experiments are presented with clarity. The proposed approach seems to show significant improvement in detecting unknown objects.,"This paper presents work on open-world object detection. The main idea is to use fixed per-category semantic anchors. These can be incrementally added to when new data appear. The reviewers engaged in significant discussion around the paper with many iterations of improvements to the paper. Initial concerns regarding zero-shot learning were addressed, as were remarks on presentation and claims. In the end the reviewers were split on this paper. I recommend to accept the paper on the basis of the semantic topology ideas and the thorough experimental results. The remaining concern centered around the evaluation protocol used in the paper, which follows that in the literature (e. g. Joseph et al. CVPR 21). While this is not a",0.8396378755569458,0.43690531188622117
"The paper proposes a new approach to deep state-space learning, using a hidden- parameter-MDP (HiP-MDPs) to encode the time-varying aspect of the dynamics. The proposed model bears resemblance to the Kalman VAE (KVAE) [Fraccaro et al. The paper proposes a new approach to deep state-space learning, using a hidden- parameter-MDP (HiP-MDPs) to encode the time-varying aspect of the dynamics. The paper proposes a new approach to deep state-space learning, using a hidden- parameter-MDP (HiP","The paper addresses a few very important points on sequential latent-variable models, and introduce a different view on meta-RL. Even though the methods that this paper poses are incremental, it is such a hot-debated topic that I would prefer to see this published now.",0.8245485424995422,0.4874749779701233
The paper presents an interesting approach to solving routing problems that can outperform some existing approaches. The paper is well-written and presents an interesting approach to solving TSP that can outperform some other existing approaches. The paper is well-written and presents an interesting approach to solving TSP that can outperform some other existing approaches. The paper is well-written and presents an interesting approach to solving TSP that can outperform some other existing approaches. The paper is well-written and presents an interesting approach to solving TSP that can outperform some other existing approaches. The paper is well-written and presents an interesting approach to solving TSP that can outperform some other existing approaches,"In this paper, a novel machine learning-based method for solving TSP is presented; this method uses guided local search in conjunction with a graph neural network, which is trained to predict regret. Reviewers disagree rather sharply on the merits of the paper. Three reviewers think that the paper is novel, interesting, and has good empirical results. Two reviewers think that the fact the results are not competitive with the best non-learning-based (""classic"") solvers mean that the paper should be rejected. This area chair believes that research is fundamentally not about beating benchmarks, but about new, interesting, and sound ideas. The conceptual novelty of this method, together with the good results compared with other learning-based methods",0.8242483735084534,0.4530249660213788
The paper is well written and mostly to follow Table 2 shows clear improvements in performance over the standard NLL approach Weak Points Section 3. The discussion of the optimization issue caused by the NLL is very clear with nice synthetic examples. The results in the experimental evaluation is lacking. The presentation is very clear and well-organized. The paper is well written and mostly to follow Table 2 shows clear improvements in performance over the standard NLL approach Weak Points Section 3. The paper is well written and mostly to follow Table 2 shows clear improvements in performance over the standard NLL approach Weak Points Section 3. The presentation is very clear and well,"The paper examines the approach of modeling aleatoric uncertainty by fitting a neural network, that estimates mean and variances of a heteorscedasitic Gaussian distribution, based on log likelihood maximization. The authors identify the problem that gradient based training on the netgative log likelihood (NLL) may result in suboptimal solutions where a high predicted variance compensates for the predicted mean being far from the true mean. To solve this problem, the authors suggest to adjust the log likelihood objective by weighting the log likelihood of each single data point by the corresponding beta-exponentiated variance estimate. This adjusted objective is referred to as beta-NLL. All reviewers agreed that the identified problem and",0.799807608127594,0.3054740369319916
"The paper is well written. The experiments and baselines are well-chosen. I am not saying that the paper has to provide additional experiments on ""those"" datasets. The experiments and baselines are well-chosen.","The paper proposes using the intermediate representation learned in a denoising diffusion model for the label-efficient semantic segmentation task. The reviewers are generally positive with the submission. They like the simplicity of the proposed algorithm. They also like the effort of the paper in verifying the intermediate representation learned by a diffusion model is semantically meaningful and can be used for segmentation. Initially, there was some concern about the size of the validation set, which is addressed by the rebuttal. Consolidating the reviews and rebuttals, the meta-reviewer agrees with the assessment of the reviewers and would like to recommend acceptance of the paper.",0.8373597264289856,0.31090958788990974
"The paper is well-written and easy to follow. You forgot to bold the best performer in line 3 of Table 2 (in this case, the original compact model) - - - - - - - - - - - - - - - - - - - - - - - - - - - - - - - - - - - - - - - - - - - - - - - - - - - - - - - - - - - - - - - - - - - - - - - - - - - - - - - - - - - - - - - - - - - -","The paper studies the problem of task-specific model compression obtained from fine-tuning large pre-trained language models. The work follows the line of research in which model size is reduced by decomposing the matrices in the model into smaller factors. Two-step approaches apply SVD and then fine-tuned the model on task specific data. The present work makes the observation that after the first step (the SVD compression) the model can dramatically lose its performance, due to the mismatched optimization objectives between the low-rank approximation and the target task. The work provides evidence backing this claim. The paper proposes to address this problem by weighting the importance of parameters for the factorization according to the Fisher information.",0.7326483726501465,0.25133250032862026
"The proposed approach is technically sound and exhibits very competitive performance. The empirical evaluation is thorough as it considers multiple test problems and a broad range of benchmark methods. In general, I would recommend the authors explain their approach in a general fashion by introducing appropriate notation and then explaining it in the context of a particular problem.",This paper develops a preference-conditionedâ€ approach to approximate the Pareto frontier for Multi-Objective Combinatorial Optimization (MOCO) problems with a single model (thus dealing with the thorny problem that there can be exponentially-many Pareto-optimal solutions). It appears to provide flexibility for users to obtain various preferred tradeoffs between the objectives without extra search. The basic idea is to use end-to-end RL to train the single model for all different preferences simultaneously. The technical soundness and practical performance are strong. This work's approximation guarantee depends on the ability to approximately solve several (weighted) single-objective problems. This may be challenging due to the NP-hardness of,0.8359991312026978,0.3614337854087353
"The paper is clearly written and well presented. The results look decent, the method makes sense, and the derivations appear to be sound. The ablations and comparisons are thorough, and I'm convincined that the Proto CPC objective does have benefits over the baselines, although the numerical gains are not large.","This paper proposes a prototypical contrastive predictive coding by combining the prototypical method and contrastive learning, and presents its efficient implementation for three distillation tasks: supervised model compression, self-supervised model compression, and self-supervised learning via self-distillation. The paper is well-written, and the effectiveness of the proposed method is validated through extensive experiments. Reviewers generally agree the paper has clear merits despite some weaknesses for improvement. Overall, I would like to recommend it for acceptance and encourage authors to incorporate all the review comments and suggestions in the final version.",0.8458795547485352,0.41112807144721353
"The paper derives a method based on the graph criterion. Overall, the strength of this paper is in the formulation of adversarial examples as a causal problem. The robustness learning method based on adversarial alignment is not explained well and involves choices that are unjustified.","The paper shows a causal perspective to the adversarial robustness problem. Based on a causal graph of the adversarial data creation process, which describes the perceived data as a function of content and style variables, the authors identified that the spurious correlation between style and label is the main reason for adversarial examples. Based on this observation, they propose a method to learn models for which the conditional distribution of label given style and image does not vary much when attacked. Experiments on MNIST, CIFAR-10, and CIFAR-100 datasets show that the proposed method is better than two baselines, Madry and TRADES. Overall, the paper contains interesting ideas and tackles an important problem. Due to some concerns regarding the clarity",0.8638381361961365,0.46156256149212516
This paper is lacking a conclusion section. 3. The numerical experiments are based on real data set and are comprehensive. The experimental results are preliminary and conclusions are not clear.,"This paper considers the problem of distributionally robust fair PCA for binary sensitive variables. The main modeling contribution of the paper is the consideration of fairness and robustness of the PCA simultaneously, and the main technical contribution of the paper is the provision of a Riemannian subgradient descent algorithm for this problem and proof that it reaches local optima of this non-convex optimization problem. The results will be of interest to those working at the intersection of fair and robust learning.",0.8377811312675476,0.2665100836505493
"The novelty of this paper is somewhat weak., link prediction, graph clustering, etc. In practice, this may not always be true as it depends on the size of the search space of injected nodes and the degree of node v.","The reviewers agree that this paper studies an important problem, provides theoretically analysis to understand graph injection attack. The authors propose a new regularizer to improve the attack success. Extensive experimental results also show the effectiveness of the proposed method.",0.8515424132347107,0.29398368050654733
"This paper proposes a method for learning to communicate with deep multi-agent reinforcement learning. The authors propose a method for learning to communicate with deep multi-agent reinforcement learning. All reviewers agree that the paper is well-written, with solid motivation, and thoughtful care in crafting the approach.07024. The main concerns raised in the paper are the assumptions underlying the approach, and itâ€™s situation relative to prior work in hierarchical, and specifically Feudal RL. However, the bulk of my criticism focuses on the assumptions underlying the approach, and itâ€™s situation relative to prior work in hierarchical, and specifically Feudal RL. The","This paper proposes a cognitive science-inspired interaction setting between two agents, an ""architect"" and ""builder"", in which the architect must produce messages to guide the builder to achieve a task. Unlike other related settings (such as typical approaches in MARL, HRL, or HRI), the builder does not have access to the architect's reward function, and must learn to interpret the architect's messages by assuming the architect is telling it to do something sensible. At the same time, the architect determines what is ""sensible"" by building a model of the builder's behavior and planning over it. This setting is common particularly in human-agent interactions, where humans may not",0.821018397808075,0.34269237518310547
