This paper presents a semi-synthetic dataset that learns label-irrelevant features that are useful for classifying rare classes. The paper is well written in general and its motivation is clear. The paper is well written in general and its motivation is clear. The paper is well written in general and its motivation is clear. The paper is well written in general and its motivation is clear. The paper is well written in general and its motivation is clear. The paper is well written in general and its motivation is clear. The paper is well written in general and its motivation is clear. The paper is well written in general and its motivation is clear,"This paper is proposed to investigate the robustness of self-supervised learning (SSL) and supervised learning (SL) in both balanced (in domain) and imbalanced (out of domain) settings. It can be concluded that SL can regularly learn better representations than SSL, and representations are better from balanced than from imbalanced datasets. The SSL is more robust than SL in the imbalanced settings, which is the crucial of this paper. Expect the experimental results, the authors also provided theoretical analysis to support their claims. The authors also extend a well-established method SAM into the Reweighted SAM as the technical contribution to better address the imbalanced setting. The paper is well written with clear logic to follow",0.8117906451225281,0.5511446512407727
This paper presents a new method to train on datasets based on DFT. The proposed PESNet obtains SOTA or near-SOTA results compared to previous methods while being much faster to train. All reviewers agree that the proposed method is novel and interesting. I would urge the authors to change the text to make it easier to follow.,"This paper builds on the success of the FermiNet neural wave function framework by pairing it with a graph neural network which predicts the parameters of neural wave function from the geometry. The resulting PESNet trains significantly faster, with no loss of accuracy. This method constitutes an important advance in ML-powered quantum mechanical calculations. The reviewers unanimously recommend acceptance.",0.8730487823486328,0.46908635273575783
This paper makes a fundamental contribution to the reward-free exploration field. The theoretical results are strong and interesting. The paper did a good job such that readers can grasp the high level proof idea. The proposed solution to the technical challenge of the Bernstein-type analysis under this scenario is novel.,"This paper addresses the reward-free exploration problem with function approximation under linear mixture MDP assumption. The analysis shows that the proposed algorithm is (nearly) minimax optimal. The proposed approach can work with any planning solver to provide an ( +opt )-optimal policy for any reward function. After reading the authors' feedback and discussing their concerns, the reviewers agree that the contributions in this paper are valuable and that this paper deserves publication. I encourage the authors to follow the reviewers' suggestions as they will prepare the camera-ready version.",0.8617919087409973,0.3680565722286701
"This paper proposes a new setting of NCD where meta-learning can be used to improve the performance. The proposed method can improve the performance with large margins, which is important to the field. The results are reasonably well-discussed, and include both few-data (the setting of the paper) and large-data results. There is a typo in (2), it should be mathbbPpi(X) rather than mathbbPX, which makes me very confused when I read (2). However, the connection between (D) and Y->X is not very clear","All reviewers believe that this paper is valuable, and the authors have made a significant, careful contribution. Some suggestions from the area chair: - ""in causality"" is not a standard technical term and also not non-technical idiomatic English, so it should be explained the first time it is used. - The authors should briefly cite and discuss research on so-called positive and unlabeled (PU) learning. This seems like the special case where there is exactly one known class and one novel class. The distinction between sampling in causality and labeling in causality appears in the PU literature, though not under this name. - The authors could also mention the obvious but surprising point that if data are generated by two",0.8256971836090088,0.3249024408559005
"The paper raises interesting questions, but ultimately cannot compellingly make the case for the proposed approach. The contributions do not make sense in the context of the introduction. The vertical axis is not labeled and three different scale metrics are plotted side by side.",The paper describes a new model-based RL technique for constrained MDPs based on Bayesian world models. It improves sample efficiency and safety. The reviewers are unanimous in their recommendation for acceptance. This represents an important advance in RL. Great work!,0.8550171852111816,0.21930112193028134
"The paper presents an interesting addition to the literature on analyzing VAEs, and is novel to the best of my knowledge. The paper is generally clear and the claims are easy to follow. The problem of VAE posterior collapse and degeneracy is an old and tired one, however, the solution proposed by the paper is very interesting and to my knowledge completely novel. Even though Thm 1 is not new, bringing up this result in the context of VAE is a valuable contribution. (4a,4b) the partition function should also depend on theta and phi, also small typo in (4b) Strength",Wide agreement from the reviewers. Interesting theorems. Empirical work illustrates the theory. Claim and insight: failure of VAEs is caused by the inherent limitations of ELBO learning with inflexible encoder distribution. Good discussion pointed out related work and insights from the experiments.,0.8383830785751343,0.28804577738046644
"This paper proposes an approach to the problem of goal-conditioned imitation learning, based on the idea of hindsight relabeling. The idea is that by generating demonstrations using hindsight relabelling, we are able to apply goal-conditioned imitation learning primitives. The authors propose a variant of DT, called Categorical DT, that resembles conditions on a desired future state or feature distribution. The authors also propose that the method can learn from more signal from fixed data than reward.","The paper describes a framework that unifies several previous lines under hindsight information matching. Within that framework, the paper also describes variants of the decision transformer (DT) called categorical DT and unsupervised DT. The rebuttal was quite effective and the reviewers confirmed that their concerns are addressed. The revised version of the paper is significantly improved and consists of an important contribution that should interested many researchers. Well done!",0.8481857180595398,0.3820797210559249
"This paper presents a new generation of sequence optimization algorithms. The reviewers found that the proposed algorithms are interesting and bear consideration for future design efforts. The main weakness is in presentation of the link itself. This comment is based on equation 3, which I could be misunderstanding. However its exposition does give clear intuition for what is going on.","The paper investigates various approaches, and a unifying framework, for sequence design. There were a variety of opinions about the paper. It was felt, after discussion, that the paper would benefit from a sharper focus, and somewhat suffers from being overwhelmed by various approaches, lacking a clear narrative. But overall all reviewers had a positive sentiment, and the paper makes a nice contribution to the growing body of work on protein design.",0.8656068444252014,0.35635336488485336
This paper introduces more attention to the periodicity modeling of time series forecasting in deep learning scenarios. The proposed model achieves better performance compared to previous methods such as N-BEATS. Experiments on different settings and parameters are provided.,"The paper proposed a novel deep learning model specifically designed for periodic time series forecasting problems. The approach includes lay-by-layer expansion, residual learning, and periodic parametrization. The model outperforms state-of-the-art baselines on several time series forecasting benchmarks. The reviewers appreciate the extensive experimental results, but also suggested improvement on writing and comparison regarding the parameter efficiency of the model.",0.883350133895874,0.4925745638708274
"All three works appear to use degree histogram, clustering histogram, as well as the number of orbits with 4 nodes (which was left out from this paper). The paper also notes and makes a point in the experiments how three popular works all use different kernels, descriptors, hyperparameters, however one of the works (Niu et al). The authors provide valuable insight and learning which would hopefully advance the state of research.","This paper provides an overview of evaluating graph generative models (GGMs). It systematically evaluates one of the more popular metrics, maximum mean discrepancy (MMD). It highlights some challenges and pitfalls for practitioners and suggests some ways to mitigate them. The reviewers found the paper practically relevant and several reviewers upgraded their scores through the discussion process. The authors acknowledged there are still some remaining issues regarding (i) considering other metrics & descriptor functions; ii) evaluating node/edge attributes and iii) addressing molecule generation. I am satisfied that these areas are beyond the scope of the current work and that the clarification improvements in the paper are adequate. It stands well enough on its own to accept in its present form.",0.8316188454627991,0.2896114499086425
"This paper provides a theoretical statement on the OOD behaviour of NatPNs in the limit. g. for the near OOD datasets e., 2020. This is a significant potential advantage over Posterior Networks.","This paper presents a method for producing higher quality uncertainty estimates by mapping the predictions from an arbitrary (e. g. deep learning) model to an exponential family distribution. This is achieved by using the model to map from the inputs to a low-dimensional latent space and then using a normalizing flow to map to the parameters of the distribution. The authors show empirically that this improves over a variety of baselines on a number of OOD and uncertainty quantification tasks. This paper received 5 reviews who all agreed that the paper should be accepted (6, 6, 8, 8, 8). The reviewers in general found the method novel compared to existing literature, compelling and the results strong. Multiple reviewers asked for experiments with higher dimensional",0.8312020897865295,0.4379885233938694
"The main idea is quite conceptually simple and an interesting approach to develop altruism for MARL. e. A more realistic setting would be one in which the two are trained at the same time or at least, there are multiple training stages for both of them (that alternate). The paper is technically sound but very hard to follow through. The experimental section of the paper is well executed, and the analysis of the results is thorough. The method is new as far as I know, although some of its elements have been used in other contexts, but I think the authors do a good job at explaining the connections to related work.","This work proposed a method for encouraging an agent showing altruistic behaviour towards another agent (leader) without having access to the leader's reward function. The basic idea is based on the hypothesis that having the ability to reach many future states (i. e., called choice) is useful for the leader agent, no matter what it reward function is. The altruistic agent learns a policy that maximizes the choice of the leader agent. The paper defines three notions of choice, and evaluates them on four environments. The reviewers believe that this work attempts to solve an important problem, proposes a novel approach, and performs reasonably good experiments. The reviewers are all on the positive side at the end of the discussion phase",0.8392404913902283,0.31352423752347625
"The paper proposes a new setting for multi-agent MDPs, called Multi-Agent MDPs (MMDPs). The reviewers were initially concerned that MMDPs would require action encoders with auxiliary losses to stabilize learning. While the paper doesn't mention it, payoff based edge selection method might be an interesting case for resolving some of the future work mentioned in [2].","All reviewers found that the paper offers interesting contributions for multi-agent RL and favour acceptance of the paper. The strengths of the paper are summarized below: - Good algorithmic contribution - Offers a new set of benchmark tasks for coordination in MARL settings - Exhaustive experiments on complex tasks with a reasonable number of agents - All the issues raised by the reviewers (missing references, missing discussion of limitations...) have been satisfactorliy addressed. I therefore join the reviewers in the recommendation to accept the paper.",0.8411745429039001,0.36056874692440033
"This paper studies the approximation properties of RNN encoder-decoders, in the perspective of linear and continuous time. The reviewers agree that the paper is well-motivated and the results are interesting.","This paper presents a theoretical analysis of the approximation properties of linear recurrent encoder-decoder architectures, obtaining universal approximation results and subsequently showing approximation rates of targets for RNN encoder-decoders. It introduces a notion of ""temporal products,"" which helps to characterize the types of temporal relationships that can be efficiently learned in this setting. Overall, the reviewers and I all agree that this paper makes important theoretical contributions to the important problem of the approximation capabilities of encoder-decoder architectures. The main weaknesses involve the rather simplified linear problem setup, but this limitation is easily forgiven in this first-of-its-kind rigorous analysis. I recommend acceptance.",0.8843387365341187,0.49982345998287203
This paper proposes a simple method for learning image classification techniques. The authors provide rigorous of properties for all Pixelated Butterfly components. The paper is well-motivated and well-motivated. The reviewers found the paper to be well-motivated and well-motivated. The reviewers found the paper to be well-motivated and well-motivated.,"This is an intriguing work that introduces a novel sparse training technique. The core insight is a novel reparametrization or sparsity pattern based on the so-called butterfly matrices that enables fast training and good generalization. The theory is solid and useful. Most importantly, the method is novel and is likely to become impactful. Understanding better what contributes to the excellent performance is an interesting question for future work. In agreement with all the reviewers, it is my pleasure to accept the work.",0.8397204875946045,0.2795047792295615
The paper proposes block-wise quantization (dynamic) to reduce the states (momentum and second moment) in diagonal first orders. The paper implements a 8-bit Adam implementation that works as well as its f32 variant while being memory efficient.,"This paper proposes Adam and Momentum optimizers, where the optimizer state variables are quantized to 8bit using block dynamics quantization. These modifications significantly improve the memory requirements of training models with many parameters (mainly, NLP models). These are useful contributions which will enable training even larger models than possible today. All reviewers were positive.",0.8631900548934937,0.37086080806329846
"The paper proposes the idea of connecting summary statistics with the robustness to adversarial attacks. I feel the paper has a number of points that should be clarified by the authors before it can be accepted for publication at ICLR. The authors say that the representation of robust nets is similar to the representations of the models of peripheral vision. I do not find the IQA analysis convincing either. I would love to understand the role of visual angle in the experiments. However, this is far from being the same as saying that the representations are equivalent or similar. In this situation, who is responsible for the human-like behavior of tilde","This paper shows that images synthesized to match adversarially robust representations are similar to original images to humans when viewed peripherally. This was not true for adversarially non-robust representations. Additionally the adversarially robust representations were similar to the texform model image from a model of human peripheral vision. Reviewers increased their score a lot during the rebuttal period as the authors provided more details on the experiments and agreed to tone down some of the claims (especially the strong claim that the robust representations capture peripheral computation similar to current SOA texture peripheral vision models). As well stated by reviewer s6dV, two representations with the same null-space are not necessarily the same. With reviewer scores of 8",0.8513274192810059,0.4402902026971181
"This paper presents a new convolutional kernel method for si, ci, f and wi in ODConv, and investigates the proposed attention mechanism regarding four types of convolutional kernel attentions si, ci, f and wi in our ODConv. The authors provide more experiments to show that the ODConv can also bring promising accuracy improvements to the backbones (MobileNetV3-Small and ResNet18), incorporating the SE module. The authors do not discuss any potential limitations or disadvantages compared to reference methods.","This paper presents ODConv, a convolution pattern which uses attention in the convolutions across all dimensions of the weight tensor. The paper is well motivated and well explained, easy to follow. This work is built on top of previous work, but reviewers all agree that the contributions of this paper are significant. The experimental section is comprehensive, with several benchmarks, and show clear improvements. The reviewers suggested a few additional remarks, and discussions to add to the paper, which the authors have addressed in the rebuttal. Reviewers seem in general happy with the authors answers to their concerns. This seems like a sound and meaningful paper. I am fully in favour of acceptance, and I recommend this paper to be presented",0.8343874216079712,0.4184236995254954
"The paper presents a new method to train Vit models. The proposed method is simple while effective. As have explained in Sec. Pros: The proposed method is simple while effective. Meanwhile, the recognition accuracy does not drop much.","The paper presents an approach to select visual tokens in images and reorganize them for the object classification, within Transformers. All four reviewers find the paper interesting and novel, and they are also very positive about the experimental results. The authors also addressed minor concerns of the reviewers successfully through the discussion phase, clarifying details and adding experiments. We recommend accepting the paper.",0.8555903434753418,0.2422904759645462
"The paper is well-motivated and easy to follow. However, I'd be very happy to change my mind on this topic. The paper is well-motivated and easy to follow. However, I'd be very happy to change my mind on this topic. The paper is well-motivated and easy to follow. However, I'd be very happy to change my mind on this topic. The paper is well-motivated and easy to follow. However, I'd be very happy to change my mind on this topic. The paper is well-motivated and easy to follow. However, I'd be very","This paper introduces a new technique for discovering closed-form functional forms (ordinary differential equations) that explain noisy observed trajectories x(t) where the ""label"" x'(t) = f(x(t), t) is not observed, but without trying to approximate it. The method first tries to approximate a smoother trajector xhat(t), then relies on a variational formulation using a loss function over functionals C_j_j, defined in terms of an orthonormal basis g_1,..., g_S of sampling functions such that the sum of squares of all the C_j approximates the theoretical distance between f(",0.7673158049583435,0.1574522003531456
"This paper introduces STGG, a node-by-node graph generation method. The method is evaluated on standard ZINC250K, QM9 benchmarks and compared with many previous baselines. The paper is well written. The experiments of the work are comprehensive and well designed.","This paper proposes a spanning tree-based graph generation framework for molecular graph generation, which is an interesting problem. The tree-based approach is efficient and relatively effective in molecular graph generation tasks, and the empirical results are convincing. There were some concerns during the initial reviews, but all of them have been addressed during the discussion phase. Thus, I recommend this work be accepted.",0.8705045580863953,0.3653418440371752
"The paper proposes a series of principled improvements to state-of-the-art MCTS planning algorithms. The paper is well written and I enjoyed reading it. Some minor presentation issues are listed as following. However, the variance would become high for more than 400 Elo difference, and hence makes Figure 3 and Figure 4 unconvincing. The authors should give more discussion.","The paper presents improvements to AlphaZero and MuZero for settings where one is restricted in the number of rollouts. The initial response from reviewers was generally favorable but the reviewers wanted more details and clarifications of multiple parts of the paper, and further intuition about the Gumbel distribution. The authorsâ€™ responses were detailed and convinced or maintained strong positive support of most reviewers. The authors also stated that they plan to provide a release of the code and also provided a policy improvement proof. Overall this is an interesting approach that is likely to be of significant interest to many.",0.8534355759620667,0.3478626161813736
"The paper builds a convincing case for the proposed method by calling attention to the mismatch of goals in traditional training procedures and conformal prediction. The extension to other structure-inducing losses is interesting, although its actual deployment may warrant caution.","In this paper, a new learning scheme for minimizing the confidence set by conformal prediction is proposed. Most of the reviewers agree that the idea is interesting and novel. This is an important contribution to trustworthy ML, with theoretically sound considerations and thorough experimental validation.",0.872273862361908,0.3883694733182589
"This paper studies the impact of each training task, to zero-shot learning 11- T0, on zero-shot learning datasets. The reviewers found that T0 outperforms 7 out of 11 zero-shot datasets, but it outperforms on 2 out of 4 zero-shot tasks. The authors perform an important study to verify that data for those tasks is not leaked through the pretraining corpus which addresses memorization concerns.","This paper studies constructing text2text transformer models that are good at zero-shot task generalization via multi-task learning over a diverse set of NLP tasks. One main contribution of the work is to create prompt templates for various NLP tasks (that are of different task formats) such that all tasks can be framed into text2text learning format and that is ""natural"" to the pretrained T6 model. The paper conducts extensive experiments to demonstrate the promising zero-shot generalization ability of such multi-task learner. Strength: - Important problem setup that has broad applications - Extensive experiments to validate the claims - Useful resources are developed for the problem Weakness: - Good to study the effect of using different combination",0.8444902896881104,0.4976529230674108
The writing is clear and the overall algorithm is well explained. The paper in its current stage misses on the opportunity of exploiting this. The discussion of the related work seems complete to my knowledge.,"This paper addresses a continuous-time formulation of gradient-based meta-learning (COMLN) where the adaptation is the solution of a differential equations. In general, outer loop optimization requires backpropagating over trajectories involving gradient updates in the inner loop optimization. It is claimed that one of main advantages of COMLN is able to compute the exact meta-gradients in a memory-efficient way, regardless of the length of adaptation trajectory. To this end, the forward-mode differentiation is used, with exploiting the Jacobian matrix decomposition. All the reviewers agree that the derivation of memory-efficient forward-mode differentiation is a significant contribution in the few-shot learning. The paper is well",0.8305420875549316,0.34388471270600957
